channel_name,video_title,video_url,publish_date,video_length,views,likes,comments,transcript_filename
First Code Academy,PYTHON PUSH NOTIFICATION TUTORIAL | PYTHON CODING TUTORIAL FOR BEGINNERS,https://www.youtube.com/watch?v=97GePNcMjsM,2021-01-13,7:34,944,9,2,pythonpushnotificationtutorialpythoncodingtutorialforbeginners.txt
First Code Academy,How to Make a Python Chinese Zodiac Generator | Beginner Python Tutorial,https://www.youtube.com/watch?v=ZYtIE5gj6f0,2021-02-12,10:38,1933,28,0,howtomakeapythonchinesezodiacgeneratorbeginnerpythontutorial.txt
First Code Academy,PYTHON TURTLE CHRISTMAS CARD TUTORIAL | PYTHON TURTLE GRAPHICS CODING TUTORIAL FOR BEGINNERS,https://www.youtube.com/watch?v=7aOu_HmIXd0,2020-12-18,16:54,709,11,0,pythonturtlechristmascardtutorialpythonturtlegraphicscodingtutorialforbeginners.txt
First Code Academy,How to Make A Python Easter Card | Beginner Python Turtle Tutorial,https://www.youtube.com/watch?v=oYEqkr9ttuY,2021-04-02,26:17,2264,11,1,howtomakeapythoneastercardbeginnerpythonturtletutorial.txt
First Code Academy,How to Make A Python Tic Tac Toe Game | Beginner Python Tutorial,https://www.youtube.com/watch?v=KCClZbd9pCg,2021-05-18,19:14,1356,12,0,howtomakeapythontictactoegamebeginnerpythontutorial.txt
First Code Academy,How to Make A Snake Game - Part II | Beginner Python Tutorial,https://www.youtube.com/watch?v=K0R8T__WZWw,2021-06-16,15:50,1007,11,1,howtomakeasnakegamepartiibeginnerpythontutorial.txt
First Code Academy,Draw Fireworks Using Python | Beginner Python Turtle Tutorial,https://www.youtube.com/watch?v=QgyhHuk3EY4,2021-07-07,10:46,3291,24,1,drawfireworksusingpythonbeginnerpythonturtletutorial.txt
First Code Academy,Make a Simple Music Player Using Python | Beginner Python Tutorial,https://www.youtube.com/watch?v=9IidiU5YzqQ,2021-08-04,13:44,2829,26,3,makeasimplemusicplayerusingpythonbeginnerpythontutorial.txt
First Code Academy,How to make your own Minecraft Thanksgiving Pumpkin Pie | Beginner Minecraft Coding Tutorial,https://www.youtube.com/watch?v=cWe_fkf7yYI,2020-11-20,21:10,1387,10,0,howtomakeyourownminecraftthanksgivingpumpkinpiebeginnerminecraftcodingtutorial.txt
First Code Academy,HOW TO MAKE A MINECRAFT SWORD | Minecraft Modding Tutorial for Beginners | MCreator Tutorial,https://www.youtube.com/watch?v=Pojp6GtlDus,2021-01-15,8:45,13515,156,30,howtomakeaminecraftswordminecraftmoddingtutorialforbeginnersmcreatortutorial.txt
First Code Academy,How to Make a Custom Health Minecraft Potion | Beginner Minecraft Tutorial,https://www.youtube.com/watch?v=eIaPb-XpUYI,2021-02-03,8:49,1811,20,2,howtomakeacustomhealthminecraftpotionbeginnerminecrafttutorial.txt
First Code Academy,How to Make a Red Envelope in Minecraft | Beginner Minecraft Designing Tutorial,https://www.youtube.com/watch?v=ppxmKlzHDdU,2021-02-10,11:34,232,6,0,howtomakearedenvelopeinminecraftbeginnerminecraftdesigningtutorial.txt
First Code Academy,Make A Lightning Minecraft Arrow | Beginner Minecraft Tutorial,https://www.youtube.com/watch?v=U-51Vl6m1Rc,2021-02-19,11:52,658,5,2,makealightningminecraftarrowbeginnerminecrafttutorial.txt
First Code Academy,How to Make a Minecraft Lucky Block | Beginner Minecraft Tutorial,https://www.youtube.com/watch?v=t9ZekyiyPyU,2021-03-02,12:18,3410,39,3,howtomakeaminecraftluckyblockbeginnerminecrafttutorial.txt
First Code Academy,How to Make a Minecraft Obstacle Course - Part I | Beginner Minecraft Building Tutorial,https://www.youtube.com/watch?v=qkOQ6dgIAyc,2021-03-19,8:02,768,9,0,howtomakeaminecraftobstaclecoursepartibeginnerminecraftbuildingtutorial.txt
First Code Academy,Make A Minecraft Castle Using Javascript | Beginner Minecraft Tutorial,https://www.youtube.com/watch?v=RTThj1NWmAM,2021-03-25,9:44,762,6,1,makeaminecraftcastleusingjavascriptbeginnerminecrafttutorial.txt
First Code Academy,How to Make a Minecraft Obstacle Course - Part II | Beginner Minecraft Building Tutorial,https://www.youtube.com/watch?v=Nayqn3Ln_Co,2021-03-26,11:15,203,8,0,howtomakeaminecraftobstaclecoursepartiibeginnerminecraftbuildingtutorial.txt
First Code Academy,How to Build a Simple Minecraft Water Slide | Beginner Minecraft Building Tutorial,https://www.youtube.com/watch?v=u7eP5SUuGw0,2021-04-16,13:47,452,7,0,howtobuildasimpleminecraftwaterslidebeginnerminecraftbuildingtutorial.txt
First Code Academy,How to Build a Simple Minecraft Roller Coaster | Beginner Minecraft Building Tutorial,https://www.youtube.com/watch?v=TS5385znIN8,2021-04-22,17:08,566,5,0,howtobuildasimpleminecraftrollercoasterbeginnerminecraftbuildingtutorial.txt
First Code Academy,How to Build a Minecraft Camp Cabin | Beginner Minecraft Building Tutorial,https://www.youtube.com/watch?v=8fyoLTR31KE,2021-05-12,17:57,151,6,0,howtobuildaminecraftcampcabinbeginnerminecraftbuildingtutorial.txt
First Code Academy,How to Make a Minecraft Beacon | Beginner Minecraft Coding Tutorial,https://www.youtube.com/watch?v=F4qyROySAoM,2021-05-20,19:30,154,5,0,howtomakeaminecraftbeaconbeginnerminecraftcodingtutorial.txt
First Code Academy,Make a Evil Mob Spawning Cube in Minecraft | Beginner Minecraft Tutorial,https://www.youtube.com/watch?v=CLSMpX1GSMs,2021-06-03,11:42,207,1,0,makeaevilmobspawningcubeinminecraftbeginnerminecrafttutorial.txt
First Code Academy,Make Custom Commands to Summon Nether Entities | Beginner Minecraft Coding Tutorial,https://www.youtube.com/watch?v=2HrSR2g4Pxw,2021-06-11,10:24,191,1,0,makecustomcommandstosummonnetherentitiesbeginnerminecraftcodingtutorial.txt
First Code Academy,How to Build a Minecraft Mob Traps - Part II | Beginner Minecraft Building Tutorial,https://www.youtube.com/watch?v=LRmKpdcjsqA,2021-07-27,7:39,363,4,1,howtobuildaminecraftmobtrapspartiibeginnerminecraftbuildingtutorial.txt
First Code Academy,How to Make A Roblox City - Part II | Beginner Roblox Designing Tutorial,https://www.youtube.com/watch?v=pHeIzkbDipg,2021-01-29,15:41,768,9,1,howtomakearobloxcitypartiibeginnerrobloxdesigningtutorial.txt
First Code Academy,Find the Red Envelope Game - Part I | Beginner Roblox Designing Tutorial,https://www.youtube.com/watch?v=jo9y52kY7g4,2021-02-05,13:44,553,14,2,findtheredenvelopegamepartibeginnerrobloxdesigningtutorial.txt
First Code Academy,Find the Red Envelope Game - Part II | Beginner Roblox Coding Tutorial,https://www.youtube.com/watch?v=SXwbf_52JEM,2021-02-09,9:57,311,5,0,findtheredenvelopegamepartiibeginnerrobloxcodingtutorial.txt
First Code Academy,How to Make A Roblox City - Part III | Beginner Roblox Design Tutorial,https://www.youtube.com/watch?v=V7bO4HzSVSs,2021-02-18,13:28,430,4,0,howtomakearobloxcitypartiiibeginnerrobloxdesigntutorial.txt
First Code Academy,How to Make A Roblox City - Part IV | Beginner Roblox Design Tutorial,https://www.youtube.com/watch?v=p2MwFcI3Qrs,2021-03-04,9:43,1241,15,0,howtomakearobloxcitypartivbeginnerrobloxdesigntutorial.txt
First Code Academy,Reach for the Star- Part I | Beginner Roblox Designing Tutorial,https://www.youtube.com/watch?v=sGmat6JRfgk,2021-03-11,11:13,376,3,1,reachforthestarpartibeginnerrobloxdesigningtutorial.txt
First Code Academy,Get the Easter Egg- Part I | Beginner Roblox Designing Tutorial,https://www.youtube.com/watch?v=hL_UXR6LbOg,2021-03-31,20:52,131,2,0,gettheeastereggpartibeginnerrobloxdesigningtutorial.txt
First Code Academy,Get the Easter Egg- Part II | Beginner Roblox Tutorial,https://www.youtube.com/watch?v=_9G3xQ0R700,2021-03-31,21:30,174,0,0,gettheeastereggpartiibeginnerrobloxtutorial.txt
First Code Academy,How To Make a Simple Obby Game - Part I | Beginner Roblox Designing Tutorial,https://www.youtube.com/watch?v=T-SDnqmlvXE,2021-04-09,14:25,7336,54,8,howtomakeasimpleobbygamepartibeginnerrobloxdesigningtutorial.txt
First Code Academy,How To Make an Simple Obby Game - Part II | Beginner Roblox Coding Tutorial,https://www.youtube.com/watch?v=Sl3ArdX3R-w,2021-04-15,11:44,600,5,0,howtomakeansimpleobbygamepartiibeginnerrobloxcodingtutorial.txt
First Code Academy,How To Make an Advance Obby Game - Part I | Beginner Roblox Designing Tutorial,https://www.youtube.com/watch?v=Af5dtohbx1o,2021-04-23,23:07,1053,10,0,howtomakeanadvanceobbygamepartibeginnerrobloxdesigningtutorial.txt
First Code Academy,How To Make an Advance Obby Game - Part III | Beginner Roblox Designing Tutorial,https://www.youtube.com/watch?v=IeftKew5WVQ,2021-05-15,27:51,335,3,2,howtomakeanadvanceobbygamepartiiibeginnerrobloxdesigningtutorial.txt
First Code Academy,Build a Drum Kit on a Web Page | Beginner JQuery Tutorial,https://www.youtube.com/watch?v=qQq1aoP5PZA,2021-05-26,12:17,280,3,2,buildadrumkitonawebpagebeginnerjquerytutorial.txt
First Code Academy,How To Make an Advance Obby Game - Part V | Beginner Roblox Designing Tutorial,https://www.youtube.com/watch?v=i6h47GDmypI,2021-06-08,18:38,258,2,0,howtomakeanadvanceobbygamepartvbeginnerrobloxdesigningtutorial.txt
First Code Academy,Cross the Bridge - Part 1 | Beginner Roblox Designing Tutorial,https://www.youtube.com/watch?v=re3Q1Y0L33M,2021-08-09,12:04,557,9,0,crossthebridgepart1beginnerrobloxdesigningtutorial.txt
First Code Academy,Cross the Bridge - Part II | Beginner Roblox Designing Tutorial,https://www.youtube.com/watch?v=SfVFTJgynb4,2021-08-13,12:01,528,6,3,crossthebridgepartiibeginnerrobloxdesigningtutorial.txt
First Code Academy,"HTML, CSS & JAVASCRIPT TUTORIAL | New Year Resolution Webpage | Beginner Web Programming Tutorial",https://www.youtube.com/watch?v=-r7o9ABrm5I,2020-12-31,14:29,540,3,0,htmlcssjavascripttutorialnewyearresolutionwebpagebeginnerwebprogrammingtutorial.txt
First Code Academy,Make an Animated Clock with CSS | CSS ANIMATION TUTORIAL | CSS TUTORIALS FOR BEGINNERS,https://www.youtube.com/watch?v=z1oupW7jVYg,2020-12-22,7:52,1813,25,1,makeananimatedclockwithcsscssanimationtutorialcsstutorialsforbeginners.txt
First Code Academy,HTML & CSS TUTORIAL | Create a Sunny Day Driving Animation | Easy Coding Project,https://www.youtube.com/watch?v=d8RR87UIs9w,2020-12-01,10:11,179,6,0,htmlcsstutorialcreateasunnydaydrivinganimationeasycodingproject.txt
First Code Academy,How to Make a Movie Scroller Web Page | Beginner HTML & CSS Tutorial,https://www.youtube.com/watch?v=IjkJvAtaZ4A,2021-03-16,20:24,265,2,0,howtomakeamoviescrollerwebpagebeginnerhtmlcsstutorial.txt
First Code Academy,How to Make a 3D Spinning Globe | Beginner HTML & CSS Tutorial,https://www.youtube.com/watch?v=AAwVKcjpdS8,2021-04-20,16:26,6059,61,5,howtomakea3dspinningglobebeginnerhtmlcsstutorial.txt
First Code Academy,How to Make a Recycle Survey Web Form Page | Beginner HTML & CSS Tutorial,https://www.youtube.com/watch?v=L6URbAKNErA,2021-04-27,28:28,214,2,0,howtomakearecyclesurveywebformpagebeginnerhtmlcsstutorial.txt
First Code Academy,How to Make a 3D Picture Cube | Beginner HTML & CSS Tutorial,https://www.youtube.com/watch?v=bDOk3mQnVCI,2021-05-06,23:37,638,6,1,howtomakea3dpicturecubebeginnerhtmlcsstutorial.txt
First Code Academy,Build a Matching Card Game (Animal Edition) | Beginner JQuery Tutorial,https://www.youtube.com/watch?v=Dp8NjR_ZBFQ,2021-06-01,17:23,836,5,0,buildamatchingcardgameanimaleditionbeginnerjquerytutorial.txt
First Code Academy,Build a Emoji Loading Bar | Beginner Web Programming Tutorial,https://www.youtube.com/watch?v=NkEJ7EFIhZA,2021-08-19,18:34,612,5,0,buildaemojiloadingbarbeginnerwebprogrammingtutorial.txt
First Code Academy,Connecting Dash To Tickle,https://www.youtube.com/watch?v=VKsrASBaKp4,2020-04-11,4:17,207,2,0,connectingdashtotickle.txt
First Code Academy,Introduction To Dash Robotics,https://www.youtube.com/watch?v=4fIHDi9iSQo,2020-04-11,6:04,878,1,0,introductiontodashrobotics.txt
First Code Academy,How to make an animation on Scratch | Beginner Scratch Tutorial | 5 Facts About You!,https://www.youtube.com/watch?v=HzOEf1Sdep0,2020-04-02,20:06,573,6,0,howtomakeananimationonscratchbeginnerscratchtutorial5factsaboutyou.txt
First Code Academy,How to build a game on Scratch | Dodge the Virus Part 1 | Beginner Scratch Coding Tutorial,https://www.youtube.com/watch?v=VypuhVQvWDQ,2020-03-30,18:49,16778,191,0,howtobuildagameonscratchdodgetheviruspart1beginnerscratchcodingtutorial.txt
First Code Academy,How to build a game on Scratch | Dodge the Virus Part 2 | Beginner Scratch Coding Tutorial,https://www.youtube.com/watch?v=W9-mw-Z0Fog,2020-04-14,14:36,1016,14,1,howtobuildagameonscratchdodgetheviruspart2beginnerscratchcodingtutorial.txt
First Code Academy,How to make your own piano using Scratch | Beginner Scratch Tutorial | Easy Scratch Project,https://www.youtube.com/watch?v=Wqe9ynT67As,2020-11-14,10:51,1381,18,0,howtomakeyourownpianousingscratchbeginnerscratchtutorialeasyscratchproject.txt
First Code Academy,How to Make a Scratch Animation About Nature | Beginner Scratch Tutorial,https://www.youtube.com/watch?v=JiHgHj5r26Q,2021-01-26,9:58,1247,6,0,howtomakeascratchanimationaboutnaturebeginnerscratchtutorial.txt
First Code Academy,How to Make a Scratch Maze Game | Beginner Scratch Tutorial,https://www.youtube.com/watch?v=7OBDwJyW5Vc,2021-01-28,15:02,42036,254,0,howtomakeascratchmazegamebeginnerscratchtutorial.txt
First Code Academy,Learn to Draw a Recycle Logo in Scratch | Beginner Scratch Tutorial,https://www.youtube.com/watch?v=k80gJFbB8KQ,2021-02-02,22:10,468,7,0,learntodrawarecyclelogoinscratchbeginnerscratchtutorial.txt
First Code Academy,Scratch Heart Clicker Game | Beginner Scratch Tutorial,https://www.youtube.com/watch?v=NAKz81CU0HQ,2021-02-11,16:47,1346,9,1,scratchheartclickergamebeginnerscratchtutorial.txt
First Code Academy,Scratch Recycle and Sort Game | Beginner Scratch Tutorial,https://www.youtube.com/watch?v=jyHAcXt5fCc,2021-02-25,20:26,11643,108,6,scratchrecycleandsortgamebeginnerscratchtutorial.txt
First Code Academy,How to Make a Space Battle Game| Beginner ScratchJR Tutorial,https://www.youtube.com/watch?v=sJOIVGN3rKI,2021-03-09,18:09,29154,219,15,howtomakeaspacebattlegamebeginnerscratchjrtutorial.txt
First Code Academy,How to Make a Scratch Spring Card | Beginner Scratch Animation Tutorial,https://www.youtube.com/watch?v=U9NeWA4rEt0,2021-03-23,18:57,903,11,1,howtomakeascratchspringcardbeginnerscratchanimationtutorial.txt
First Code Academy,How to Make an Easter Game In Scratch | Beginner Scratch Tutorial,https://www.youtube.com/watch?v=viBNb_UIn-8,2021-04-01,26:55,13823,176,11,howtomakeaneastergameinscratchbeginnerscratchtutorial.txt
First Code Academy,How to Make a Mother’s Day Card | Beginner Scratch Animation Tutorial,https://www.youtube.com/watch?v=ZaxxFQFlLQU,2021-05-05,20:43,2353,22,2,howtomakeamothersdaycardbeginnerscratchanimationtutorial.txt
First Code Academy,Scratch Interactive Band with Video Sensing Function | Beginner Scratch Tutorial,https://www.youtube.com/watch?v=U_TR2zz_OZg,2021-05-13,11:05,3513,41,2,scratchinteractivebandwithvideosensingfunctionbeginnerscratchtutorial.txt
First Code Academy,Build a Interactive Drum Kit on Scratch | Beginner Scratch Tutorial,https://www.youtube.com/watch?v=wugkDAOHw4U,2021-05-19,13:58,2159,15,1,buildainteractivedrumkitonscratchbeginnerscratchtutorial.txt
First Code Academy,How to Make a Animal Safari Animation | Beginner ScratchJR Tutorial,https://www.youtube.com/watch?v=EyJrK8Y8Pts,2021-06-02,8:22,6477,32,0,howtomakeaanimalsafarianimationbeginnerscratchjrtutorial.txt
First Code Academy,Build a Easy Scratch Dragon Boat Game | Beginner Scratch Tutorial,https://www.youtube.com/watch?v=WR-ylBApog8,2021-06-10,11:03,573,6,0,buildaeasyscratchdragonboatgamebeginnerscratchtutorial.txt
First Code Academy,Superhero Dad Vs Alien Scratch Game | Beginner Scratch Tutorial,https://www.youtube.com/watch?v=X7GIuvU5P7M,2021-06-21,37:45,2258,23,0,superherodadvsalienscratchgamebeginnerscratchtutorial.txt
First Code Academy,Scratch Golf Game Part 1 | Beginner Scratch Tutorial,https://www.youtube.com/watch?v=qGVG5DHQpMM,2021-06-23,13:32,2272,17,1,scratchgolfgamepart1beginnerscratchtutorial.txt
First Code Academy,Scratch Golf Game Part II | Beginner Scratch Tutorial,https://www.youtube.com/watch?v=eeE2_KjWwEk,2021-06-29,11:48,920,5,1,scratchgolfgamepartiibeginnerscratchtutorial.txt
First Code Academy,Scratch Plants Vs Zombies | Beginner Scratch Tutorial,https://www.youtube.com/watch?v=IyYx_ZM5lyw,2021-07-22,16:02,5639,48,3,scratchplantsvszombiesbeginnerscratchtutorial.txt
First Code Academy,How to build a health app on App Inventor | Beginner App Inventor Tutorial,https://www.youtube.com/watch?v=xrMq1fYNJxw,2020-03-28,14:50,2311,35,0,howtobuildahealthapponappinventorbeginnerappinventortutorial.txt
First Code Academy,INTRODUCTION TO APP INVENTOR 2 | COMPLETE GUIDE TO APP INVENTOR | MAKE YOUR OWN MOBILE APP,https://www.youtube.com/watch?v=5c5LFV7C2PI,2020-04-17,8:52,1337,10,3,introductiontoappinventor2completeguidetoappinventormakeyourownmobileapp.txt
First Code Academy,INTRO TO APP INVENTOR 2: Part2 - Designer Interface,https://www.youtube.com/watch?v=03hY1YMqyjo,2020-04-21,7:08,1466,10,2,introtoappinventor2part2designerinterface.txt
First Code Academy,APP INVENTOR TUTORIAL | Make your own PUMPKIN and TURKEY Mash | Beginner App Inventor Tutorial,https://www.youtube.com/watch?v=HHoyzr55hgc,2020-11-24,19:45,457,6,0,appinventortutorialmakeyourownpumpkinandturkeymashbeginnerappinventortutorial.txt
First Code Academy,APP INVENTOR TUTORIAL | TALK TO ME App | Beginner easy App Inventor Project Idea,https://www.youtube.com/watch?v=7CY0Iwk9yC4,2020-12-15,9:23,2923,40,3,appinventortutorialtalktomeappbeginnereasyappinventorprojectidea.txt
First Code Academy,How to Make Superhero Name Generator App | Beginner App Inventor Tutorial,https://www.youtube.com/watch?v=cZrzOK0CAmw,2021-01-20,21:04,500,15,2,howtomakesuperheronamegeneratorappbeginnerappinventortutorial.txt
First Code Academy,Catch the Coins Game App | Beginner App Inventor Tutorial,https://www.youtube.com/watch?v=LllA2qW4eMI,2021-02-04,22:51,2728,31,2,catchthecoinsgameappbeginnerappinventortutorial.txt
First Code Academy,Quote Generator App [Father’s Day Edition] | Beginner App Inventor Tutorial,https://www.youtube.com/watch?v=c4yzglIrftE,2021-06-17,10:20,793,12,1,quotegeneratorappfathersdayeditionbeginnerappinventortutorial.txt
First Code Academy,Create a Wallet App - Part I | Beginner App Inventor Tutorial,https://www.youtube.com/watch?v=uWkbfDIgZF4,2021-08-27,14:38,2947,28,2,createawalletapppartibeginnerappinventortutorial.txt
First Code Academy,Make An Arduino Pet Feeder | Beginner Arduino Tutorial,https://www.youtube.com/watch?v=y_uWCslpo4g,2021-07-17,26:09,11404,170,0,makeanarduinopetfeederbeginnerarduinotutorial.txt
First Code Academy,How to Make a Musical Tune using MicroBit | Beginner Micro:Bit Tutorial,https://www.youtube.com/watch?v=mpCWsmg5I3k,2021-05-04,11:50,26890,217,11,howtomakeamusicaltuneusingmicrobitbeginnermicrobittutorial.txt
First Code Academy,THUNKABLE APP MAKING TUTORIAL | Gingerbread Cookie Clicker | Teach Kids How to Code,https://www.youtube.com/watch?v=sWZiM5vLRkc,2020-12-25,23:21,3695,40,5,thunkableappmakingtutorialgingerbreadcookieclickerteachkidshowtocode.txt
First Code Academy,SCRATCH GAME CODING TUTORIAL | Dream with Astro Game | Easy Scratch Game Project,https://www.youtube.com/watch?v=ArUW5c3gDcM,2020-12-11,24:54,204,8,0,scratchgamecodingtutorialdreamwithastrogameeasyscratchgameproject.txt
First Code Academy,How to build your own traffic light | Easy Coding Tutorial | Beginner Arduino Coding,https://www.youtube.com/watch?v=026UdKNslrQ,2020-12-08,13:30,1547,12,0,howtobuildyourowntrafficlighteasycodingtutorialbeginnerarduinocoding.txt
