channel_name,video_title,video_url,publish_date,video_length,views,likes,comments,transcript_filename
Clever Programmer,web scraping eBay & PewDiePie sub count with Python + How long should I code every day? (LIVE),https://www.youtube.com/watch?v=HCl9KrXL9FQ,2019-03-19,3:31:26,8999,283,17,webscrapingebaypewdiepiesubcountwithpythonhowlongshouldicodeeverydaylive.txt
Clever Programmer,7 - what are data types in python? (Python tutorial for beginners 2019),https://www.youtube.com/watch?v=tdv3a_jz2G4,2019-03-18,3:27,6306,180,10,7whataredatatypesinpythonpythontutorialforbeginners2019.txt
Clever Programmer,6 - how to use for loops in python (Python tutorial for beginners 2019),https://www.youtube.com/watch?v=EOKU7zQXX10,2019-03-17,4:15,9182,344,43,6howtouseforloopsinpythonpythontutorialforbeginners2019.txt
Clever Programmer,5 - how to use while loops in python (Python tutorial for beginners 2019),https://www.youtube.com/watch?v=pEuneTt3Efg,2019-03-16,6:05,9490,359,22,5howtousewhileloopsinpythonpythontutorialforbeginners2019.txt
Clever Programmer,4 - how to use if else statements in python (Python tutorial for beginners 2019),https://www.youtube.com/watch?v=bIdHJJluexA,2019-03-15,6:50,13401,511,30,4howtouseifelsestatementsinpythonpythontutorialforbeginners2019.txt
Clever Programmer,3 - how do I create a calendar in python? (Python tutorial for absolute beginners 2019),https://www.youtube.com/watch?v=amFOJMmHk8I,2019-03-14,23:17,76267,1264,106,3howdoicreateacalendarinpythonpythontutorialforabsolutebeginners2019.txt
Clever Programmer,2 -  how do functions work in python? (Python tutorial for absolute beginners 2019),https://www.youtube.com/watch?v=B0HfPTrRfxg,2019-03-13,5:42,24339,577,27,2howdofunctionsworkinpythonpythontutorialforabsolutebeginners2019.txt
Clever Programmer,1 - what are variables? (Python tutorial for beginners 2019),https://www.youtube.com/watch?v=FpgJ8YX72_Y,2019-03-12,7:20,63368,1506,93,1whatarevariablespythontutorialforbeginners2019.txt
Clever Programmer,why I dropped out of college as a programmer,https://www.youtube.com/watch?v=jxHgeEmAiLM,2019-03-11,10:20,15479,899,103,whyidroppedoutofcollegeasaprogrammer.txt
Clever Programmer,best web frameworks for python,https://www.youtube.com/watch?v=5NHOgqpcJtY,2019-03-09,20:42,6563,278,60,bestwebframeworksforpython.txt
Clever Programmer,how to avoid burn out as a programmer,https://www.youtube.com/watch?v=zS6BEZ9GMIY,2019-03-07,11:58,4446,331,35,howtoavoidburnoutasaprogrammer.txt
Clever Programmer,Python for absolute beginners 2019 - TIC TAC TOE project (+Special Appearance!),https://www.youtube.com/watch?v=BHh654_7Cmw,2019-03-02,1:05:04,404602,8888,670,pythonforabsolutebeginners2019tictactoeprojectspecialappearance.txt
Clever Programmer,why I started programming (my story),https://www.youtube.com/watch?v=ujVuRBxwFU0,2019-03-01,7:16,9414,438,42,whyistartedprogrammingmystory.txt
Clever Programmer,do I need college to get a job as a programmer?,https://www.youtube.com/watch?v=ap2t8XbllJQ,2019-02-27,5:56,13180,649,75,doineedcollegetogetajobasaprogrammer.txt
Clever Programmer,how to pick a coding project that lands you a job,https://www.youtube.com/watch?v=oObVbf94nqA,2019-02-26,8:41,7724,421,40,howtopickacodingprojectthatlandsyouajob.txt
Clever Programmer,Ask me programming stuff,https://www.youtube.com/watch?v=H3dIVzpYv98,2019-02-26,55:20,4354,183,19,askmeprogrammingstuff.txt
Clever Programmer,Papa Python 7 Commandments,https://www.youtube.com/watch?v=Ua1R_LcwkaA,2019-02-25,21:14,3767,232,28,papapython7commandments.txt
Clever Programmer,most developers will fail without this one thing,https://www.youtube.com/watch?v=8tE_u8pLYu8,2019-02-16,16:55,5525,307,39,mostdeveloperswillfailwithoutthisonething.txt
Clever Programmer,don't become a programmer (brutal truth),https://www.youtube.com/watch?v=PB_fVx_wgDo,2019-02-15,21:14,84106,3641,537,dontbecomeaprogrammerbrutaltruth.txt
Clever Programmer,should you learn python in 2019?,https://www.youtube.com/watch?v=YRE1opmk0xo,2019-02-14,15:05,11491,441,53,shouldyoulearnpythonin2019.txt
Clever Programmer,How to hit your goals as a python developer in 2019 (best app),https://www.youtube.com/watch?v=aBRpCCB08AE,2019-02-13,13:46,5922,372,44,howtohityourgoalsasapythondeveloperin2019bestapp.txt
Clever Programmer,How to become a self taught programmer,https://www.youtube.com/watch?v=6U_n9omeCoo,2019-02-12,11:47,54355,3515,191,howtobecomeaselftaughtprogrammer.txt
Clever Programmer,Why most programmers are broke,https://www.youtube.com/watch?v=LIBUmv1JiNU,2019-02-10,9:08,53586,3026,481,whymostprogrammersarebroke.txt
Clever Programmer,How a 10 year old beat my ass at chess,https://www.youtube.com/watch?v=UAJoLezgEso,2019-02-05,8:49,4118,224,38,howa10yearoldbeatmyassatchess.txt
Clever Programmer,4 things I wish I knew when I started programming,https://www.youtube.com/watch?v=BWHwMtegk9k,2019-02-04,18:06,246704,12513,749,4thingsiwishiknewwhenistartedprogramming.txt
Clever Programmer,How long does it take to be a software developer?,https://www.youtube.com/watch?v=VX4Vjw949E0,2019-02-03,15:21,78573,3557,282,howlongdoesittaketobeasoftwaredeveloper.txt
Clever Programmer,Biggest mistake beginner programmers make (tutorial purgatory),https://www.youtube.com/watch?v=xsgpkEz7fAI,2019-02-02,13:09,250661,10567,534,biggestmistakebeginnerprogrammersmaketutorialpurgatory.txt
Clever Programmer,The one thing stopping you from becoming a developer,https://www.youtube.com/watch?v=-nt1_GsQx-k,2019-02-01,20:47,12196,657,88,theonethingstoppingyoufrombecomingadeveloper.txt
Clever Programmer,How To Think And Problem Solve In Coding,https://www.youtube.com/watch?v=Hb9WUEXdkCE,2019-01-31,11:00,320311,11860,365,howtothinkandproblemsolveincoding.txt
Clever Programmer,Tips on Learning How to Code in 2019,https://www.youtube.com/watch?v=2NFQbDakRF4,2019-01-30,25:32,40319,2199,149,tipsonlearninghowtocodein2019.txt
Clever Programmer,My 2019 new year's resolution (here's my #1 goal),https://www.youtube.com/watch?v=pfpTnlt7d5E,2019-01-29,15:49,4706,290,76,my2019newyearsresolutionheresmy1goal.txt
Clever Programmer,How to Maximize Your Productivity as a Developer (Power of DMO to Reach Peak Performance),https://www.youtube.com/watch?v=2vPr8jUKQS4,2019-01-26,12:36,9574,455,111,howtomaximizeyourproductivityasadeveloperpowerofdmotoreachpeakperformance.txt
Clever Programmer,How to Teach Yourself Code in 2019,https://www.youtube.com/watch?v=fIWOAVXbiCM,2019-01-20,24:24,42479,2037,413,howtoteachyourselfcodein2019.txt
Clever Programmer,Don't set 2019 goals before watching this,https://www.youtube.com/watch?v=mWGdfds8q-o,2018-12-21,3:54,17248,724,217,dontset2019goalsbeforewatchingthis.txt
Clever Programmer,Top 4 Programming Languages to Learn in 2019 to Get a Job Without a College Degree,https://www.youtube.com/watch?v=YWWfQ_aRu6g,2018-10-16,11:20,1117177,32610,2177,top4programminglanguagestolearnin2019togetajobwithoutacollegedegree.txt
Clever Programmer,How to Get a Job as a Python Developer in 2019,https://www.youtube.com/watch?v=c3FXQU3TyCU,2018-10-14,10:46,191884,6486,356,howtogetajobasapythondeveloperin2019.txt
Clever Programmer,How to Invest in Yourself to Improve Your Coding Skills (Ask Qazi #15),https://www.youtube.com/watch?v=GgzbP9WQEYA,2018-10-03,11:56,55269,2274,167,howtoinvestinyourselftoimproveyourcodingskillsaskqazi15.txt
Clever Programmer,The Most Powerful and Persuasive Word in Negotiation,https://www.youtube.com/watch?v=QdTEWfhswF4,2018-09-04,13:50,3395,145,20,themostpowerfulandpersuasivewordinnegotiation.txt
Clever Programmer,How to Pick the Best Coding Project to Learn From? (Ask Qazi #14),https://www.youtube.com/watch?v=GwIUVMgHjoQ,2018-09-04,9:07,24311,1532,88,howtopickthebestcodingprojecttolearnfromaskqazi14.txt
Clever Programmer,Should You Code Every Day? (Ask Qazi #13),https://www.youtube.com/watch?v=tvlt0Vg4Vao,2018-09-01,5:57,17204,725,85,shouldyoucodeeverydayaskqazi13.txt
Clever Programmer,Python Tricks: How to Create a String from All Elements in List (Join),https://www.youtube.com/watch?v=lS8JLodeIs0,2018-08-16,3:29,9978,354,49,pythontrickshowtocreateastringfromallelementsinlistjoin.txt
Clever Programmer,Python Tricks: How to Find the Most Common Elements in a List,https://www.youtube.com/watch?v=2EnQcXPb55w,2018-08-14,8:33,21385,531,62,pythontrickshowtofindthemostcommonelementsinalist.txt
Clever Programmer,How to Run & Grow a Business Successfully Using Aristotle's Philosophy,https://www.youtube.com/watch?v=pWduMScQT1w,2018-07-19,1:47:06,4239,122,36,howtorungrowabusinesssuccessfullyusingaristotlesphilosophy.txt
Clever Programmer,Where Clever Programmer is headed...,https://www.youtube.com/watch?v=0uG0NtUnpAM,2018-06-30,18:08,5670,227,46,wherecleverprogrammerisheaded.txt
Clever Programmer,Unboxing YouTube Silver Play Button + Celebrating 200K Subs!,https://www.youtube.com/watch?v=SgL_NEYJSUI,2018-06-12,7:09,3440,213,90,unboxingyoutubesilverplaybuttoncelebrating200ksubs.txt
Clever Programmer,High Level Business Mentorship with Mariah Coz (Group Coaching Mastermind Event),https://www.youtube.com/watch?v=0Xp4RjyFRRk,2018-05-26,4:47,2655,72,33,highlevelbusinessmentorshipwithmariahcozgroupcoachingmastermindevent.txt
Clever Programmer,Why Changing Your Environment is Extremely Difficult But Completely Necessary,https://www.youtube.com/watch?v=Fcos1l357QU,2018-05-14,39:34,4620,199,33,whychangingyourenvironmentisextremelydifficultbutcompletelynecessary.txt
Clever Programmer,How to Use Your Negative Emotions to Build a Burning Fire Inside You,https://www.youtube.com/watch?v=6rxj3su6uc8,2018-04-30,22:27,4764,238,40,howtouseyournegativeemotionstobuildaburningfireinsideyou.txt
Clever Programmer,How to Leverage Your Deeper Psychology and Inner Motivation to Make a Lasting Change,https://www.youtube.com/watch?v=cKOCtoqL47w,2018-04-23,32:55,6859,326,90,howtoleverageyourdeeperpsychologyandinnermotivationtomakealastingchange.txt
Clever Programmer,Your Python Developer Journey + Special Invitation,https://www.youtube.com/watch?v=wnE26TI_0_c,2018-03-25,13:46,11304,533,65,yourpythondeveloperjourneyspecialinvitation.txt
Clever Programmer,I'm with Jim Carrey's son + Happy St. Paddy's Day!,https://www.youtube.com/watch?v=GH08kPerRms,2018-03-18,10:29,6270,160,47,imwithjimcarreyssonhappystpaddysday.txt
Clever Programmer,Python Django Tutorial 2018 for Beginners Part 6 - Static Files,https://www.youtube.com/watch?v=c0evTd_QXYY,2018-03-07,16:55,21751,257,24,pythondjangotutorial2018forbeginnerspart6staticfiles.txt
Clever Programmer,Python Django Tutorial 2018 for Beginners Part 5 - Automated Testing,https://www.youtube.com/watch?v=DKCTMrNExAw,2018-03-04,53:47,18897,229,19,pythondjangotutorial2018forbeginnerspart5automatedtesting.txt
Clever Programmer,Python Django Tutorial 2018 for Beginners Part 4 - Generic Forms & Views,https://www.youtube.com/watch?v=3YXqA9BPs10,2018-03-01,42:36,21568,217,16,pythondjangotutorial2018forbeginnerspart4genericformsviews.txt
Clever Programmer,Surprising my Brother For His Birthday + Hiking in Lake Tahoe,https://www.youtube.com/watch?v=W6Oq1hKvkIo,2018-02-27,9:15,6535,128,22,surprisingmybrotherforhisbirthdayhikinginlaketahoe.txt
Clever Programmer,Python Django Tutorial 2018 for Beginners Part 3 - How to Create Views in Django + Templates,https://www.youtube.com/watch?v=3F0uqHb5EdI,2018-02-26,39:49,25399,275,17,pythondjangotutorial2018forbeginnerspart3howtocreateviewsindjangotemplates.txt
Clever Programmer,Python Django Tutorial 2018 for Beginners Part 2 - How to Create Models and Use Django Admin,https://www.youtube.com/watch?v=lllckjqRJOg,2018-02-21,43:10,38906,387,62,pythondjangotutorial2018forbeginnerspart2howtocreatemodelsandusedjangoadmin.txt
Clever Programmer,Python Django Tutorial 2018 for Beginners Part 1 - How to Create a Project,https://www.youtube.com/watch?v=I7WtoFivrS0,2018-02-20,27:51,196201,2079,219,pythondjangotutorial2018forbeginnerspart1howtocreateaproject.txt
Clever Programmer,My Trip to Colombia For A Business Mastermind Event,https://www.youtube.com/watch?v=OazK-35QUP8,2018-02-18,10:27,4638,175,46,mytriptocolombiaforabusinessmastermindevent.txt
Clever Programmer,The Power of Generalizing vs. Specializing to Explode Your Growth as a Programmer,https://www.youtube.com/watch?v=Ts6sm4v4-0M,2018-02-16,4:40,5679,212,33,thepowerofgeneralizingvsspecializingtoexplodeyourgrowthasaprogrammer.txt
Clever Programmer,"The Easiest Way to Get More Job Opportunities through LinkedIn, Github, or Facebook",https://www.youtube.com/watch?v=7q-mlnkfENw,2018-02-11,6:08,8137,294,47,theeasiestwaytogetmorejobopportunitiesthroughlinkedingithuborfacebook.txt
Clever Programmer,The Key Difference Between Begging vs Earning an Income,https://www.youtube.com/watch?v=m6YmJ_aEhKg,2018-02-08,3:19,6096,397,50,thekeydifferencebetweenbeggingvsearninganincome.txt
Clever Programmer,Top 5 Programming Languages to Learn in 2018 to Get a Job Without a College Degree,https://www.youtube.com/watch?v=f3EbDbm8XqY,2018-01-29,10:24,2170176,30259,2128,top5programminglanguagestolearnin2018togetajobwithoutacollegedegree.txt
Clever Programmer,Build Your Own Python Freelancer Character (Why Real Life is just an R.P.G Game),https://www.youtube.com/watch?v=_MEVoDvXUfk,2018-01-17,7:29,5648,296,52,buildyourownpythonfreelancercharacterwhyreallifeisjustanrpggame.txt
Clever Programmer,Dissecting the Process of Explosive Success - Interview with Me & My Star Student,https://www.youtube.com/watch?v=utsSPQ0LaN8,2018-01-15,46:50,3692,180,42,dissectingtheprocessofexplosivesuccessinterviewwithmemystarstudent.txt
Clever Programmer,Why Are The Best Coders Broke,https://www.youtube.com/watch?v=QAyrwJMlGis,2018-01-08,13:36,18756,737,97,whyarethebestcodersbroke.txt
Clever Programmer,Do I Have Enough Time,https://www.youtube.com/watch?v=Efdnzcql2J4,2018-01-01,8:19,4634,254,27,doihaveenoughtime.txt
Clever Programmer,Happy New Years – Here's to 2018...,https://www.youtube.com/watch?v=0mfb5nqybJw,2018-01-01,2:22,4855,314,52,happynewyearsheresto2018.txt
Clever Programmer,Let's Crush 2018 as a Python Developer – Your Invite to My Flagship Level Up Your Python Webinar,https://www.youtube.com/watch?v=YsaVkbiC58A,2017-12-28,1:01,7084,258,49,letscrush2018asapythondeveloperyourinvitetomyflagshiplevelupyourpythonwebinar.txt
Clever Programmer,The Easiest Way to Understand LISTS: One of the Most Powerful Data Types in Programming,https://www.youtube.com/watch?v=uYYsDxrBIZg,2017-12-27,5:16,3416,130,23,theeasiestwaytounderstandlistsoneofthemostpowerfuldatatypesinprogramming.txt
Clever Programmer,How to Pick The Best Programming Book,https://www.youtube.com/watch?v=NkH5UBCPKF4,2017-12-25,1:32,12130,409,59,howtopickthebestprogrammingbook.txt
Clever Programmer,How Much You Should Be Charging As A Coder,https://www.youtube.com/watch?v=97R9oXgQzBs,2017-12-18,7:09,4934,223,59,howmuchyoushouldbechargingasacoder.txt
Clever Programmer,Powerful Technique to Become a Programmer Faster – Even If You Can't Find Time,https://www.youtube.com/watch?v=saAIMpR5iSk,2017-12-11,5:52,13349,509,58,powerfultechniquetobecomeaprogrammerfasterevenifyoucantfindtime.txt
Clever Programmer,Here is what people hire web developers for... Not for plug & play WordPress websites,https://www.youtube.com/watch?v=I6bJOewiavQ,2017-12-04,11:37,43832,1318,141,hereiswhatpeoplehirewebdevelopersfornotforplugplaywordpresswebsites.txt
Clever Programmer,LIVE: I'm moving to California,https://www.youtube.com/watch?v=SKrJkbR_xqY,2017-12-01,37:54,3497,110,41,liveimmovingtocalifornia.txt
Clever Programmer,Django vs. Flask which is the best python web development framework?,https://www.youtube.com/watch?v=P8RxP8CP96c,2017-11-27,4:09,123878,2317,165,djangovsflaskwhichisthebestpythonwebdevelopmentframework.txt
Clever Programmer,How to Reverse Engineer & Hack Your Motivation,https://www.youtube.com/watch?v=XIl9RgojSck,2017-11-20,6:58,5883,248,49,howtoreverseengineerhackyourmotivation.txt
Clever Programmer,LIVE: Level Up Your Python From Zero to Your First Paycheck,https://www.youtube.com/watch?v=_RCVPx34HBY,2017-11-12,1:17:31,9064,211,32,livelevelupyourpythonfromzerotoyourfirstpaycheck.txt
Clever Programmer,Level Up Your Python from Zero to Your First Paycheck,https://www.youtube.com/watch?v=-ul3TO1o69A,2017-11-11,2:51,7329,276,73,levelupyourpythonfromzerotoyourfirstpaycheck.txt
Clever Programmer,Your Roadmap to Become a 6 Figure Python Developer (LIVE),https://www.youtube.com/watch?v=XnItgbYO8T8,2017-11-10,1:06:57,8217,284,29,yourroadmaptobecomea6figurepythondeveloperlive.txt
Clever Programmer,Web Development With Python 2018 – Most Important Things You Must Know,https://www.youtube.com/watch?v=D9CSF6ygkQc,2017-11-06,1:07:34,43244,648,81,webdevelopmentwithpython2018mostimportantthingsyoumustknow.txt
Clever Programmer,Build Your Own Python Freelance Character LIVE with Qazi,https://www.youtube.com/watch?v=alpeFw1baeI,2017-11-06,1:30:57,5816,248,37,buildyourownpythonfreelancecharacterlivewithqazi.txt
Clever Programmer,How 54 Year Old Lisa Can Use Her Age as an Advantage In Coding,https://www.youtube.com/watch?v=CpO-akSrTdY,2017-11-04,4:41,4272,136,17,how54yearoldlisacanuseherageasanadvantageincoding.txt
Clever Programmer,Why Most Programmers Are Broke & How You Can Avoid It (LIVE),https://www.youtube.com/watch?v=TBrdj_tl_7I,2017-11-04,1:15:00,8158,303,31,whymostprogrammersarebrokehowyoucanavoiditlive.txt
Clever Programmer,Discovering this one thing has changed my entire life...,https://www.youtube.com/watch?v=Vyfxma_eA2k,2017-11-02,4:12,28437,1300,105,discoveringthisonethinghaschangedmyentirelife.txt
Clever Programmer,Your Potential as a Highly Paid Python Developer – The Profitable Programmer Masterclass is now live,https://www.youtube.com/watch?v=j9CnQE6Mjo8,2017-11-02,1:04:40,10011,352,19,yourpotentialasahighlypaidpythondevelopertheprofitableprogrammermasterclassisnowlive.txt
Clever Programmer,How to Use Fear and Regret to Power Through Your Mental Barriers and My Story Where I Felt Helpless,https://www.youtube.com/watch?v=RTlIN4CPwIc,2017-10-30,11:40,3997,243,53,howtousefearandregrettopowerthroughyourmentalbarriersandmystorywhereifelthelpless.txt
Clever Programmer,100K Subs Celebration! Special Live Event with Qazi – Let's Make History – Ask Me Anything,https://www.youtube.com/watch?v=l2Beb29Leb4,2017-10-27,1:29:05,3882,243,43,100ksubscelebrationspecialliveeventwithqaziletsmakehistoryaskmeanything.txt
Clever Programmer,Your #1 Secret to Become Massively Profitable With Python and Why It's Critical You Must Start Now,https://www.youtube.com/watch?v=tBDmCndSOEw,2017-10-25,1:08:31,12370,608,94,your1secrettobecomemassivelyprofitablewithpythonandwhyitscriticalyoumuststartnow.txt
Clever Programmer,Here Are Your 4 Secrets to Explosive Career Growth – (What I'd Do If I was 18 Again),https://www.youtube.com/watch?v=OYWgWSwkfKs,2017-10-23,7:33,7029,392,53,hereareyour4secretstoexplosivecareergrowthwhatiddoifiwas18again.txt
Clever Programmer,Help Me Make This Channel About You,https://www.youtube.com/watch?v=pioPgFxHGGM,2017-10-18,1:54,1975,132,131,helpmemakethischannelaboutyou.txt
Clever Programmer,The Best Free Course on Python – Learn Python Programming,https://www.youtube.com/watch?v=29rk6k8MHDU,2017-10-16,6:08,90493,2746,235,thebestfreecourseonpythonlearnpythonprogramming.txt
Clever Programmer,Should I Learn Scratch Programming Before Python,https://www.youtube.com/watch?v=5Er0S2jIlcM,2017-10-09,8:40,35600,1359,181,shouldilearnscratchprogrammingbeforepython.txt
Clever Programmer,The Money Mindset of Millionaires,https://www.youtube.com/watch?v=hkHKwGOF8uI,2017-10-02,15:29,2627,131,42,themoneymindsetofmillionaires.txt
Clever Programmer,Live Q&A Ask Qazi Anything and My Flagship Python Course,https://www.youtube.com/watch?v=RD1w1eLiakE,2017-09-28,33:56,2662,115,27,liveqaaskqazianythingandmyflagshippythoncourse.txt
Clever Programmer,Why You Should Become a Python Developer,https://www.youtube.com/watch?v=vPDEzWJkmWM,2017-09-25,13:27,60927,2147,186,whyyoushouldbecomeapythondeveloper.txt
Clever Programmer,How to Stop Procrastinating - Top 4 Ways,https://www.youtube.com/watch?v=g09Bllp7JZ4,2017-09-18,31:36,18024,1176,157,howtostopprocrastinatingtop4ways.txt
Clever Programmer,What Can You Do With Python – Computer Programming (Guide),https://www.youtube.com/watch?v=kK_2mzBARTU,2017-09-11,16:00,1017235,26338,1027,whatcanyoudowithpythoncomputerprogrammingguide.txt
Clever Programmer,The Power of Taking Action + My New Website,https://www.youtube.com/watch?v=uq5iUsC7Y_c,2017-09-06,13:30,2988,96,33,thepoweroftakingactionmynewwebsite.txt
Clever Programmer,Am I Too Old to Start Coding?,https://www.youtube.com/watch?v=MfTZFC7Aps0,2017-09-04,11:35,15069,636,105,amitoooldtostartcoding.txt
Clever Programmer,Why You NEED to Be Consistent to Be a Programmer,https://www.youtube.com/watch?v=YbrdNjVc5WI,2017-08-28,6:44,6927,339,53,whyyouneedtobeconsistenttobeaprogrammer.txt
Clever Programmer,How to Make a Web App with Python - UFC Voting App,https://www.youtube.com/watch?v=K8ljvO_93VU,2017-08-23,31:16,16098,326,94,howtomakeawebappwithpythonufcvotingapp.txt
Clever Programmer,How Long Should You Code Every Day and Best Resources for Practicing,https://www.youtube.com/watch?v=qxQ4dHpzKFE,2017-08-21,6:56,362896,16837,1646,howlongshouldyoucodeeverydayandbestresourcesforpracticing.txt
Clever Programmer,Dispelling The Myth of Being Self-Taught,https://www.youtube.com/watch?v=oShcFBDpSYQ,2017-08-14,11:04,11200,460,83,dispellingthemythofbeingselftaught.txt
Clever Programmer,Successful People vs Lazy People – Overcome Procrastination,https://www.youtube.com/watch?v=IeWu28Twigg,2017-08-07,13:24,12260,1037,148,successfulpeoplevslazypeopleovercomeprocrastination.txt
Clever Programmer,Why Being Faster Will Make You More Money,https://www.youtube.com/watch?v=OnwoYfeRnQA,2017-07-31,11:40,7051,315,44,whybeingfasterwillmakeyoumoremoney.txt
Clever Programmer,Why consultants get paid more than freelancers,https://www.youtube.com/watch?v=Uy8OVNIKOqc,2017-07-24,7:24,7649,231,45,whyconsultantsgetpaidmorethanfreelancers.txt
Clever Programmer,Hour of Python - Coding Challenge 11 | Apples and Oranges,https://www.youtube.com/watch?v=8iLSbev47xE,2017-07-17,8:51,5047,104,18,hourofpythoncodingchallenge11applesandoranges.txt
Clever Programmer,Happy Birthday to me,https://www.youtube.com/watch?v=HkyklE2PPek,2017-07-14,2:38:08,4454,249,53,happybirthdaytome.txt
Clever Programmer,Hour of Python - Coding Challenge 9 | US States,https://www.youtube.com/watch?v=_wJ_PO-7bFE,2017-07-03,7:07,5673,127,24,hourofpythoncodingchallenge9usstates.txt
Clever Programmer,Your Fastest Python Freelancer Roadmap,https://www.youtube.com/watch?v=jFZsyfNC27c,2017-06-29,1:28:03,14022,332,48,yourfastestpythonfreelancerroadmap.txt
Clever Programmer,"How to Become a Python Developer in months, NOT years",https://www.youtube.com/watch?v=LPIZEFAhoPE,2017-06-27,1:21:47,49704,1103,103,howtobecomeapythondeveloperinmonthsnotyears.txt
Clever Programmer,Hour of Python - Coding Challenge 8 | Abbreviator,https://www.youtube.com/watch?v=flpBqNgSVKU,2017-06-26,9:21,4558,112,22,hourofpythoncodingchallenge8abbreviator.txt
Clever Programmer,Create Apps with Python and Land Your First Client,https://www.youtube.com/watch?v=i1tkDUEMNRo,2017-06-24,1:11:02,57798,685,57,createappswithpythonandlandyourfirstclient.txt
Clever Programmer,Can You Really Become a Software Developer in Less Than 3 Months?,https://www.youtube.com/watch?v=B5ub0m8MmDM,2017-06-22,1:06:19,8485,262,35,canyoureallybecomeasoftwaredeveloperinlessthan3months.txt
Clever Programmer,Hour of Python - Coding Challenge 7 | Number of Things,https://www.youtube.com/watch?v=PkPZxK4_cr0,2017-06-19,7:51,5349,122,33,hourofpythoncodingchallenge7numberofthings.txt
Clever Programmer,Python Coding Challenge 6 | Oxford Comma,https://www.youtube.com/watch?v=lBxcDT-mxCg,2017-06-13,7:47,7278,143,31,pythoncodingchallenge6oxfordcomma.txt
Clever Programmer,Hour of Python - Coding Challenge 5 | Gerund Slicing,https://www.youtube.com/watch?v=RAdxx4zQn8M,2017-06-05,6:57,5408,115,47,hourofpythoncodingchallenge5gerundslicing.txt
Clever Programmer,Hour of Python - Coding Challenge 4 | Reverse Slicing,https://www.youtube.com/watch?v=eul22vnv_80,2017-05-29,6:11,8058,162,38,hourofpythoncodingchallenge4reverseslicing.txt
Clever Programmer,Hour of Python – Coding Challenge 3 | Aardvark Zebra Index,https://www.youtube.com/watch?v=l11Oq9YAgT4,2017-05-22,3:31,7998,126,31,hourofpythoncodingchallenge3aardvarkzebraindex.txt
Clever Programmer,How Coding Can Help You Start Your Own Business,https://www.youtube.com/watch?v=haXd_5j3T_M,2017-05-17,11:19,12445,352,51,howcodingcanhelpyoustartyourownbusiness.txt
Clever Programmer,Hour of Python – Coding Challenge 2 | Switch Case,https://www.youtube.com/watch?v=ydCR_G9nirY,2017-05-15,4:47,21003,290,40,hourofpythoncodingchallenge2switchcase.txt
Clever Programmer,Hour of Python – Coding Challenge 1 | Lowercase and Uppercase,https://www.youtube.com/watch?v=WsTsMkmgLOA,2017-05-08,3:51,51176,573,71,hourofpythoncodingchallenge1lowercaseanduppercase.txt
Clever Programmer,Where to Find Clients as Python Freelancer?,https://www.youtube.com/watch?v=cxTb_a9Nkc0,2017-05-01,5:43,45822,964,113,wheretofindclientsaspythonfreelancer.txt
Clever Programmer,How to Make $100/hr as a Freelance Software Developer (No Degree Required),https://www.youtube.com/watch?v=yyd0rNyrlS8,2017-04-27,13:09,405224,7366,565,howtomake100hrasafreelancesoftwaredevelopernodegreerequired.txt
Clever Programmer,Python OOP™ Create Apps course closes in 5 minutes. It's now or never. Q&A,https://www.youtube.com/watch?v=EA-XTJs2A90,2017-03-23,23:43,8871,103,32,pythonoopcreateappscourseclosesin5minutesitsnoworneverqa.txt
Clever Programmer,My Learn Python OOP™ (Create Apps) course enrollment ends tonight in 3 hours and Q&A,https://www.youtube.com/watch?v=4PkmaAjuGms,2017-03-23,2:06:41,12848,143,6,mylearnpythonoopcreateappscourseenrollmentendstonightin3hoursandqa.txt
