channel_name,video_title,video_url,publish_date,video_length,views,likes,comments,transcript_filename
Clever Programmer,JavaScript Tutorial for Beginners - Full Course in 12 Hours (2022),https://www.youtube.com/watch?v=lI1ae4REbFM,2022-06-30,12:21:23,1267050,42635,1685,javascripttutorialforbeginnersfullcoursein12hours2022.txt
Clever Programmer,So... I just got a new studio.,https://www.youtube.com/watch?v=vgtp5vElZTQ,2022-06-28,1:02:23,10104,384,22,soijustgotanewstudio.txt
Clever Programmer,Make money with coding.. WITHOUT a college degree!,https://www.youtube.com/watch?v=5NziONFxrPw,2022-05-31,15:52,40704,1915,70,makemoneywithcodingwithoutacollegedegree.txt
Clever Programmer,"🔴  Build Spotify Blockchain Web3 dApp with Next.js, Solana, Phantom, QuickNode & Digital Ocean",https://www.youtube.com/watch?v=JbZPQJpfahI,2022-05-30,3:27:36,154941,1901,86,buildspotifyblockchainweb3dappwithnextjssolanaphantomquicknodedigitalocean.txt
Clever Programmer,🔴  Build TikTok Web 3.0 Blockchain App with Solana | Rust | Next.js | Netlify,https://www.youtube.com/watch?v=qIGs3XWybgU,2022-05-18,3:56:28,106008,1830,81,buildtiktokweb30blockchainappwithsolanarustnextjsnetlify.txt
Clever Programmer,Build CoinMarketCap Web 3.0 Blockchain App with Moralis | Next.js | Tailwind CSS,https://www.youtube.com/watch?v=fim8DfBPVks,2022-05-07,4:51:42,87144,2189,132,buildcoinmarketcapweb30blockchainappwithmoralisnextjstailwindcss.txt
Clever Programmer,Build Amazon Web 3.0 Blockchain App with Solidity | Moralis | Next.js | Ethers.js | Tailwind CSS,https://www.youtube.com/watch?v=HMdwbq1JJT0,2022-04-30,2:53:27,108686,2959,163,buildamazonweb30blockchainappwithsoliditymoralisnextjsethersjstailwindcss.txt
Clever Programmer,How to become a Blockchain Developer in 2022 | Patrick Collins,https://www.youtube.com/watch?v=rIHWZijUso8,2022-04-24,1:28:00,19221,818,62,howtobecomeablockchaindeveloperin2022patrickcollins.txt
Clever Programmer,Build Facebook 3.0 on Blockchain with Solana | Next.js | Netlify | Sanity.io,https://www.youtube.com/watch?v=8v5lFscLPRY,2022-04-19,3:36:04,81239,1486,71,buildfacebook30onblockchainwithsolananextjsnetlifysanityio.txt
Clever Programmer,Stuck in Tutorial Hell? Watch This. #shorts,https://www.youtube.com/watch?v=SoEWkU8FNIA,2022-04-14,0:33,42750,2282,51,stuckintutorialhellwatchthisshorts.txt
Clever Programmer,How to Make $100k/year as Blockchain Developer (with Founder of Moralis),https://www.youtube.com/watch?v=05WJ9GChYuI,2022-04-04,1:16:34,14967,735,59,howtomake100kyearasblockchaindeveloperwithfounderofmoralis.txt
Clever Programmer,I’m deleting my YouTube channel.,https://www.youtube.com/watch?v=1YJYyPg5CK4,2022-04-02,5:00,37145,1781,684,imdeletingmyyoutubechannel.txt
Clever Programmer,Build Robinhood Web 3.0 Blockchain App with Moralis | Solidity | Next.js | Sanity.io | Netlify,https://www.youtube.com/watch?v=iMst9GE8wIM,2022-04-01,2:00:26,37142,1049,81,buildrobinhoodweb30blockchainappwithmoralissoliditynextjssanityionetlify.txt
Clever Programmer,Here's what to learn when you start out in Blockchain,https://www.youtube.com/watch?v=yCMgZ3oG2pE,2022-03-30,0:17,14434,630,9,hereswhattolearnwhenyoustartoutinblockchain.txt
Clever Programmer,3 GitHub Repos You NEED to Know,https://www.youtube.com/watch?v=JvrwgaTjKiA,2022-03-30,0:14,25913,2117,5,3githubreposyouneedtoknow.txt
Clever Programmer,Top 5 Crypto Exchanges in 2022,https://www.youtube.com/watch?v=m3VhIXQr0cE,2022-03-27,0:19,55299,1177,97,top5cryptoexchangesin2022.txt
Clever Programmer,How to ADD an extra $100K to your salary as a DEVELOPER,https://www.youtube.com/watch?v=OeaJWWnSR1s,2022-03-27,0:33,22484,1224,28,howtoaddanextra100ktoyoursalaryasadeveloper.txt
Clever Programmer,This is a reminder to take a moment and...,https://www.youtube.com/watch?v=uQfRJBZxd1k,2022-03-26,0:12,11001,546,30,thisisaremindertotakeamomentand.txt
Clever Programmer,Build Tinder Blockchain Web 3.0 App with Moralis | Solidity | Next.js | Sanity.io,https://www.youtube.com/watch?v=4YjUaQKE6-I,2022-03-25,1:35:58,43288,1887,96,buildtinderblockchainweb30appwithmoralissoliditynextjssanityio.txt
Clever Programmer,Top Programming Languages to Learn in 2022,https://www.youtube.com/watch?v=BbueNXEaAxw,2022-03-24,0:12,44599,1607,72,topprogramminglanguagestolearnin2022.txt
Clever Programmer,Confronting Twitch Founder Who Sold for $1B to Amazon,https://www.youtube.com/watch?v=572pHc56Ang,2022-03-23,51:28,10482,457,45,confrontingtwitchfounderwhosoldfor1btoamazon.txt
Clever Programmer,Gary Vee Gives Advice to Developers #shorts,https://www.youtube.com/watch?v=IWv1p2mhmOY,2022-03-21,0:32,20723,1031,69,garyveegivesadvicetodevelopersshorts.txt
Clever Programmer,How to make $100K/year as a Blockchain Engineer 👨‍💻,https://www.youtube.com/watch?v=MLN06A4qHrk,2022-03-15,0:58,64334,4961,45,howtomake100kyearasablockchainengineer.txt
Clever Programmer,5 Modern Ways to Deploy Your Web App to The Internet,https://www.youtube.com/watch?v=hqnkeOZ8EpE,2022-03-10,0:09,37508,1488,29,5modernwaystodeployyourwebapptotheinternet.txt
Clever Programmer,I Ask the Founder of Twitch About His Biggest Regrets,https://www.youtube.com/watch?v=fNbZ3vf7Nh0,2022-03-10,0:59,10624,364,10,iaskthefounderoftwitchabouthisbiggestregrets.txt
Clever Programmer,4 Things I Wish I Knew When I Started Programming | #Shorts,https://www.youtube.com/watch?v=sH_sJxvlrDM,2022-03-09,0:58,71552,4896,33,4thingsiwishiknewwhenistartedprogrammingshorts.txt
Clever Programmer,Why ALL developers MUST Learn Web 3.0 According to Twitch Founder #Shorts,https://www.youtube.com/watch?v=S33iYWS3QqY,2022-03-07,0:51,17901,742,12,whyalldevelopersmustlearnweb30accordingtotwitchfoundershorts.txt
Clever Programmer,Build Uber Web 3.0 Blockchain App with Next.js | Ethers.js | Sanity.io | Tailwind CSS,https://www.youtube.com/watch?v=w6N4JxqsOFA,2022-03-05,1:22:02,77852,2272,179,builduberweb30blockchainappwithnextjsethersjssanityiotailwindcss.txt
Clever Programmer,Confronting the CEO Who Turned Down $100M and Launched His NFT Collection (Ryan Carson),https://www.youtube.com/watch?v=lf3dkhomfUg,2022-03-02,50:50,10220,330,28,confrontingtheceowhoturneddown100mandlaunchedhisnftcollectionryancarson.txt
Clever Programmer,Build Discord Web 3.0 Real-Time Decentralized Chat App with Next.js | Sanity.io | Gun.js,https://www.youtube.com/watch?v=ZsV-jDk7dS8,2022-02-25,56:58,65046,2623,101,builddiscordweb30realtimedecentralizedchatappwithnextjssanityiogunjs.txt
Clever Programmer,Build Twitter Blockchain Web 3.0 App with Solidity | Next.js | Sanity.io ($200 Crypto Giveaway),https://www.youtube.com/watch?v=AUzPYEYlFyk,2022-02-19,2:18:44,106497,3605,341,buildtwitterblockchainweb30appwithsoliditynextjssanityio200cryptogiveaway.txt
Clever Programmer,Build Uniswap Blockchain Web 3.0 App with Solidity | Next.js | Sanity.io ($100 Crypto Giveaway),https://www.youtube.com/watch?v=xXxjRzdYIss,2022-02-10,1:53:43,138269,4663,204,builduniswapblockchainweb30appwithsoliditynextjssanityio100cryptogiveaway.txt
Clever Programmer,Highest Paying Blockchain Jobs in 2022,https://www.youtube.com/watch?v=tH72niGTY18,2022-02-01,0:20,372090,13226,104,highestpayingblockchainjobsin2022.txt
Clever Programmer,Build OpenSea Blockchain Web 3.0 App with Next.js | Sanity.io | thirdweb,https://www.youtube.com/watch?v=x3eRXeMB-4k,2022-01-29,2:22:31,305551,8714,505,buildopenseablockchainweb30appwithnextjssanityiothirdweb.txt
Clever Programmer,Using Redis as a Primary Database!,https://www.youtube.com/watch?v=1Jfq5eqYes4,2022-01-27,12:12,12212,375,16,usingredisasaprimarydatabase.txt
Clever Programmer,Build Coinbase Blockchain Web 3.0 App with Next.js | Sanity.io | thirdweb,https://www.youtube.com/watch?v=frCsGK4cKks,2022-01-22,4:14:10,149750,4532,303,buildcoinbaseblockchainweb30appwithnextjssanityiothirdweb.txt
Clever Programmer,Google is Firing Everyone Not Taking the Vaccine (Devs Losing Jobs),https://www.youtube.com/watch?v=Uy0CvVn0nMM,2021-12-16,9:54,23655,916,301,googleisfiringeveryonenottakingthevaccinedevslosingjobs.txt
Clever Programmer,🔴 Build Modern Cryptopunk Clone with React.js & Web 3.0,https://www.youtube.com/watch?v=hhZtiytNaBQ,2021-12-12,3:17:36,234476,4872,289,buildmoderncryptopunkclonewithreactjsweb30.txt
Clever Programmer,Your Roadmap to becoming a Frontend + Web 3.0 Developer in 2022 | 3-Day React JS + Web 3.0 Challenge,https://www.youtube.com/watch?v=Lz3m4BI1EfY,2021-12-11,1:23:53,223657,8355,216,yourroadmaptobecomingafrontendweb30developerin20223dayreactjsweb30challenge.txt
Clever Programmer,The BEST React JS & Blockchain Challenge in 2021 🔥,https://www.youtube.com/watch?v=S-yqzYIQD0k,2021-12-07,1:48,26454,1014,78,thebestreactjsblockchainchallengein2021.txt
Clever Programmer,100 Days of Coding with No Caffeine,https://www.youtube.com/watch?v=UIo9fAUJF-E,2021-11-26,6:38,14346,574,47,100daysofcodingwithnocaffeine.txt
Clever Programmer,Why should I change my career to coding?,https://www.youtube.com/watch?v=7oiRi0nc9qk,2021-11-25,0:37,69783,2906,37,whyshouldichangemycareertocoding.txt
Clever Programmer,Vision for Clever Programmer in 2022 (i need your help.),https://www.youtube.com/watch?v=03Tp09yCrms,2021-11-16,19:55,8673,463,62,visionforcleverprogrammerin2022ineedyourhelp.txt
Clever Programmer,Roadmap to becoming a Frontend Developer in under 90 Days 🚀,https://www.youtube.com/watch?v=l4QWfEKV0K8,2021-11-08,1:47:53,38999,1964,65,roadmaptobecomingafrontenddeveloperinunder90days.txt
Clever Programmer,"🔴 Uber Clone with Next JS, React JS, Tailwind CSS and Firebase (Part 3 of 3)",https://www.youtube.com/watch?v=1NugihCoLdQ,2021-11-07,1:28:04,31533,715,60,uberclonewithnextjsreactjstailwindcssandfirebasepart3of3.txt
Clever Programmer,"🔴 Uber Clone with Next JS, React JS, Tailwind CSS and Firebase (Part 2 of 3)",https://www.youtube.com/watch?v=dLHk4g55SJQ,2021-11-06,2:14:05,27925,788,28,uberclonewithnextjsreactjstailwindcssandfirebasepart2of3.txt
Clever Programmer,"🔴  Uber Clone with Next JS, React JS, Tailwind CSS and Firebase (Part 1 of 3)",https://www.youtube.com/watch?v=_VuGmykVgTg,2021-11-05,2:12:49,101150,2477,104,uberclonewithnextjsreactjstailwindcssandfirebasepart1of3.txt
Clever Programmer,Frontend Developer Guide for 2022,https://www.youtube.com/watch?v=NrVf8XEihCA,2021-11-04,1:18:10,68611,2987,101,frontenddeveloperguidefor2022.txt
Clever Programmer,Build Instagram Clone with React Native for Beginners (Firebase + Formik + Yup),https://www.youtube.com/watch?v=UbixZZDjrdU,2021-10-10,5:57:24,228627,6037,278,buildinstagramclonewithreactnativeforbeginnersfirebaseformikyup.txt
Clever Programmer,Firebase V9 - WHAT YOU NEED TO KNOW!!!,https://www.youtube.com/watch?v=SFJsgSPzsYI,2021-10-08,12:43,30139,1116,80,firebasev9whatyouneedtoknow.txt
Clever Programmer,React Native Authentication Workflow,https://www.youtube.com/watch?v=9NZwiQAye1g,2021-10-06,5:39,68628,1751,94,reactnativeauthenticationworkflow.txt
Clever Programmer,Top 5 Visual Studio Code Extensions for Programmers (2021),https://www.youtube.com/watch?v=qoQpqFu_AQc,2021-09-29,0:30,168220,8811,42,top5visualstudiocodeextensionsforprogrammers2021.txt
Clever Programmer,Here's WHY most developers FAIL (Teaching a beginner how to code),https://www.youtube.com/watch?v=NkCCNUxlGec,2021-09-22,1:00:57,31493,1351,80,hereswhymostdevelopersfailteachingabeginnerhowtocode.txt
Clever Programmer,ReactJS Tutorial for Beginners - Full Course in 20 Hours [2022],https://www.youtube.com/watch?v=0mVbNp1ol_w,2021-09-17,19:29:37,529841,21960,781,reactjstutorialforbeginnersfullcoursein20hours2022.txt
Clever Programmer,Top 3 reasons why you should learn React Native,https://www.youtube.com/watch?v=JoqjbkSTz9Y,2021-09-12,0:16,748693,20943,208,top3reasonswhyyoushouldlearnreactnative.txt
Clever Programmer,Senior ReactJS Developer Almost PUKED When He Saw This,https://www.youtube.com/watch?v=kYSi19QDf-g,2021-09-11,9:53,16877,634,74,seniorreactjsdeveloperalmostpukedwhenhesawthis.txt
Clever Programmer,We made a mistake... (Fireship tailwind controversy),https://www.youtube.com/watch?v=nsDt3vk-Z5A,2021-09-10,13:16,55512,2285,239,wemadeamistakefireshiptailwindcontroversy.txt
Clever Programmer,🔴 Build Tesla Clone with React Native for iOS and Android,https://www.youtube.com/watch?v=y7-IG4SSI3E,2021-09-03,2:04:06,31806,1292,43,buildteslaclonewithreactnativeforiosandandroid.txt
Clever Programmer,Tailwind CSS in 2 minutes (edited title),https://www.youtube.com/watch?v=ZT6Tp7EPH3M,2021-08-24,2:39,37743,1665,250,tailwindcssin2minuteseditedtitle.txt
Clever Programmer,"Building a TO DO LIST App with JavaScript, HTML, CSS, & Firebase",https://www.youtube.com/watch?v=KA_8eOIsjn4,2021-08-21,2:42:56,50542,1442,61,buildingatodolistappwithjavascripthtmlcssfirebase.txt
Clever Programmer,"Build a Rock Paper Scissors Game with JavaScript, HTML, & CSS",https://www.youtube.com/watch?v=C6jSg4VPNZE,2021-08-20,2:17:07,32381,1090,31,buildarockpaperscissorsgamewithjavascripthtmlcss.txt
Clever Programmer,"Build a Professional Landing Page worth $10k with HTML, CSS & JavaScript",https://www.youtube.com/watch?v=olQCJqdzBdk,2021-08-19,2:38:26,58248,1971,84,buildaprofessionallandingpageworth10kwithhtmlcssjavascript.txt
Clever Programmer,Learn to Code | Your Opportunity to Become a Fullstack Developer in 2021,https://www.youtube.com/watch?v=v6zq_Odaw6E,2021-08-18,1:20:07,12333,573,24,learntocodeyouropportunitytobecomeafullstackdeveloperin2021.txt
Clever Programmer,We Taught a Homeless Person How to Code | Here's What Happened,https://www.youtube.com/watch?v=491P9NseXFM,2021-08-08,6:57,41670,2131,231,wetaughtahomelesspersonhowtocodehereswhathappened.txt
Clever Programmer,"Build Amazon 2.0 with JavaScript and Firebase (Tailwind CSS, HTML, & CSS)",https://www.youtube.com/watch?v=FkqZfGEav9c,2021-07-31,2:31:14,22241,696,38,buildamazon20withjavascriptandfirebasetailwindcsshtmlcss.txt
Clever Programmer,"Build Amazon 2.0 Cart Page with JavaScript (Tailwind CSS, Firebase, HTML, & CSS)",https://www.youtube.com/watch?v=lfxzyE5Gs84,2021-07-30,1:31:35,17342,681,15,buildamazon20cartpagewithjavascripttailwindcssfirebasehtmlcss.txt
Clever Programmer,"Build Amazon 2.0 with JavaScript (Tailwind CSS, Firebase, HTML, & CSS)",https://www.youtube.com/watch?v=HkTXe-O1ArM,2021-07-29,2:34:14,42451,1508,42,buildamazon20withjavascripttailwindcssfirebasehtmlcss.txt
Clever Programmer,Learn to Code | Your Opportunity to Become a Fullstack Developer in 2021,https://www.youtube.com/watch?v=iO7YWnTVLZs,2021-07-28,2:48:57,23489,1049,28,learntocodeyouropportunitytobecomeafullstackdeveloperin2021_2.txt
Clever Programmer,Elon Musk Doesn't Care About Your College Degree | Real Developer Reacts,https://www.youtube.com/watch?v=nJI1uZyFH4k,2021-07-27,11:33,17637,1393,81,elonmuskdoesntcareaboutyourcollegedegreerealdeveloperreacts.txt
Clever Programmer,How the CEO of Hackernoon Started one of the Largest Coding Platforms ft. David Smooke,https://www.youtube.com/watch?v=v7fduGHdXjg,2021-07-23,1:20:27,8442,378,22,howtheceoofhackernoonstartedoneofthelargestcodingplatformsftdavidsmooke.txt
Clever Programmer,I tried learning Typescript in 1 day...,https://www.youtube.com/watch?v=kSukGsJ0s9A,2021-07-20,7:46,52802,2813,98,itriedlearningtypescriptin1day.txt
Clever Programmer,Want to get a developer job? Give up these 4 things.,https://www.youtube.com/watch?v=M-QJpTs1tqQ,2021-07-16,1:35:56,20148,1058,36,wanttogetadeveloperjobgiveupthese4things.txt
Clever Programmer,The Dark Side of JavaScript.,https://www.youtube.com/watch?v=E5_I7ff5YRI,2021-07-01,33:18,29154,1623,145,thedarksideofjavascript.txt
Clever Programmer,🔴 Build a SaaS Product using ES6 JavaScript | Day 4 of the 5-Day Coding Bootcamp,https://www.youtube.com/watch?v=60iplLAVmuA,2021-06-26,3:36:20,39326,1189,59,buildasaasproductusinges6javascriptday4ofthe5daycodingbootcamp.txt
Clever Programmer,Starbucks Clone | Building a Startup Landing Page that's worth over $10k | Day 2,https://www.youtube.com/watch?v=DX2f5wAGrkk,2021-06-24,3:26:50,54227,1923,87,starbucksclonebuildingastartuplandingpagethatsworthover10kday2.txt
Clever Programmer,Learn to Code | Your Opportunity to Become a Fullstack Developer in 2021,https://www.youtube.com/watch?v=dF3DIm6VB0g,2021-06-23,3:39:44,49448,2908,72,learntocodeyouropportunitytobecomeafullstackdeveloperin2021_3.txt
Clever Programmer,Why you can’t code. (4 Inconvenient Truths About Software Development),https://www.youtube.com/watch?v=mGrFhbTJH6M,2021-06-23,22:29,17161,657,56,whyyoucantcode4inconvenienttruthsaboutsoftwaredevelopment.txt
Clever Programmer,Writing code is slow & stupid. Do this instead.,https://www.youtube.com/watch?v=qXQ5BE1G5PI,2021-06-18,29:57,22757,1357,101,writingcodeisslowstupiddothisinstead.txt
Clever Programmer,"🔴 Building Coinbase with React Native (Redux, Firebase)",https://www.youtube.com/watch?v=GPdzGn1bPu8,2021-06-03,3:14:25,38598,1173,72,buildingcoinbasewithreactnativereduxfirebase.txt
Clever Programmer,STOP writing code. Do this instead.,https://www.youtube.com/watch?v=P2cU2sEI-Vo,2021-06-01,33:21,48837,2376,163,stopwritingcodedothisinstead.txt
Clever Programmer,STOP watching tutorials. Code like this instead.,https://www.youtube.com/watch?v=d01vkk3CYi0,2021-05-26,18:20,274141,13628,684,stopwatchingtutorialscodelikethisinstead.txt
Clever Programmer,Fullstack dev reacts to epic javascript codepens,https://www.youtube.com/watch?v=4nVDijlvVG0,2021-05-25,11:23,32824,1207,62,fullstackdevreactstoepicjavascriptcodepens.txt
Clever Programmer,How I Landed a 6 Figure Job Out of College (as a Software Developer),https://www.youtube.com/watch?v=KrPq8b9mt4w,2021-05-23,8:46,15355,792,78,howilandeda6figurejoboutofcollegeasasoftwaredeveloper.txt
Clever Programmer,I decided to hack together an app with React JS.,https://www.youtube.com/watch?v=J-x5eHcEdgg,2021-05-22,24:58,20594,960,69,idecidedtohacktogetheranappwithreactjs.txt
Clever Programmer,Ranking the MOST Accurate Programming Shows,https://www.youtube.com/watch?v=6cNXkg8UcRI,2021-05-21,25:58,8087,367,30,rankingthemostaccurateprogrammingshows.txt
Clever Programmer,Learn How to Build Your First App with React Native (Chill Sesh),https://www.youtube.com/watch?v=PJ1CmZ7yav0,2021-05-18,1:39:54,35397,1247,74,learnhowtobuildyourfirstappwithreactnativechillsesh.txt
Clever Programmer,Face Detection + Machine Learning with React JS (Real Time Object Detection using Tensorflow),https://www.youtube.com/watch?v=UIO3uyI_p7k,2021-05-16,1:05:07,34116,956,30,facedetectionmachinelearningwithreactjsrealtimeobjectdetectionusingtensorflow.txt
Clever Programmer,🔴 Building the Tesla Clone with ReactJS (Redux + Styled Components),https://www.youtube.com/watch?v=lUeS9Wsj6dk,2021-05-14,2:15:40,136756,4150,207,buildingtheteslaclonewithreactjsreduxstyledcomponents.txt
Clever Programmer,I challenged the JavaScript King to a CSS battle... Can I beat him?,https://www.youtube.com/watch?v=2GlkCuGy3rk,2021-05-12,27:22,60566,2439,210,ichallengedthejavascriptkingtoacssbattlecanibeathim.txt
Clever Programmer,I'm Doing 5 React Native Projects in 2 Weeks...,https://www.youtube.com/watch?v=INPRBmEJ5kY,2021-05-11,5:48,12947,833,157,imdoing5reactnativeprojectsin2weeks.txt
Clever Programmer,Build LinkedIn with React JS (Firebase + Styled Components + Redux),https://www.youtube.com/watch?v=xP3cxbDUtrc,2021-05-05,7:07:55,247252,7159,483,buildlinkedinwithreactjsfirebasestyledcomponentsredux.txt
Clever Programmer,Real Developer Reacts to Gilfoyle Debugging Code in Silicon Valley,https://www.youtube.com/watch?v=xsXxFBFCQKY,2021-05-05,9:42,128028,3030,280,realdeveloperreactstogilfoyledebuggingcodeinsiliconvalley.txt
Clever Programmer,"🔴Disney+ Clone - ReactJS Challenge (Learn Redux, React JS, Styled Components, and Firebase) | Day 2",https://www.youtube.com/watch?v=KPUEvRo5xtY,2021-05-02,1:44:03,79668,1601,189,disneyclonereactjschallengelearnreduxreactjsstyledcomponentsandfirebaseday2.txt
Clever Programmer,"🔴Disney+ Clone - ReactJS Challenge (Learn Redux, React JS, Styled Components, and Firebase) | Day 1",https://www.youtube.com/watch?v=kn8HPNwPEkw,2021-05-01,3:20:18,129762,3357,121,disneyclonereactjschallengelearnreduxreactjsstyledcomponentsandfirebaseday1.txt
Clever Programmer,How to Land a Job as a Full Stack Developer in 2021,https://www.youtube.com/watch?v=Aaiv_nf6oEQ,2021-04-30,21:27,12820,731,35,howtolandajobasafullstackdeveloperin2021.txt
Clever Programmer,how i learned React Native in 1 day (my experience),https://www.youtube.com/watch?v=2tjXpbs8Gdc,2021-04-29,6:29,193328,6831,287,howilearnedreactnativein1daymyexperience.txt
Clever Programmer,🔴 How a 22 Year Old Builds a 6-Figure Software Agency,https://www.youtube.com/watch?v=tYxmx_RZrWg,2021-04-26,1:38:52,15296,713,22,howa22yearoldbuildsa6figuresoftwareagency.txt
Clever Programmer,Beginner VS Pro Developer | EP 4,https://www.youtube.com/watch?v=QxVwBzZcaNs,2021-04-26,38:09,16682,520,28,beginnervsprodeveloperep4.txt
Clever Programmer,Search Algorithm: Binary Search,https://www.youtube.com/watch?v=vGcQjuw4BD0,2021-04-23,15:44,7101,440,21,searchalgorithmbinarysearch.txt
Clever Programmer,Learn Big O Notation in 20 Minutes,https://www.youtube.com/watch?v=mtRc2SeVNAE,2021-04-22,20:17,10658,687,27,learnbigonotationin20minutes.txt
Clever Programmer,🔴 Next.JS vs. Gatsby (Which Framework is Better?),https://www.youtube.com/watch?v=UvRMgoJY5q0,2021-04-20,1:07:33,16402,785,32,nextjsvsgatsbywhichframeworkisbetter.txt
Clever Programmer,Let's talk about Apple's 4/20 Event | EP 3,https://www.youtube.com/watch?v=8bCp12epN6E,2021-04-20,52:19,4452,159,6,letstalkaboutapples420eventep3.txt
Clever Programmer,Finding your coding mentor | EP 2,https://www.youtube.com/watch?v=LpRui08qhjs,2021-04-19,30:45,4847,164,13,findingyourcodingmentorep2.txt
Clever Programmer,🔴 How a 22 Year Old Built a Million Dollar Software Agency Without College Degree,https://www.youtube.com/watch?v=NsZRto4L8FQ,2021-04-14,1:59:27,17061,730,44,howa22yearoldbuiltamilliondollarsoftwareagencywithoutcollegedegree.txt
Clever Programmer,how i became a software developer,https://www.youtube.com/watch?v=UM3fjtM04Hs,2021-04-08,43:32,15807,775,63,howibecameasoftwaredeveloper.txt
Clever Programmer,Top 15 Highest Paying Software Developer Jobs In 2021 | Clever Programmer,https://www.youtube.com/watch?v=2SO0RclVBuQ,2021-04-07,16:48,45559,1666,77,top15highestpayingsoftwaredeveloperjobsin2021cleverprogrammer.txt
Clever Programmer,self taught vs. college degree vs. coding bootcamp (what's right for you?),https://www.youtube.com/watch?v=teonkx5lsvo,2021-04-06,18:32,27907,2350,243,selftaughtvscollegedegreevscodingbootcampwhatsrightforyou.txt
Clever Programmer,How Anh Went from Making $20k/year at Postmates to $70k/year as a React JS Developer,https://www.youtube.com/watch?v=j5TBwf0zGcE,2021-04-02,46:22,7569,239,35,howanhwentfrommaking20kyearatpostmatesto70kyearasareactjsdeveloper.txt
Clever Programmer,My Advice for New Programmers 2021 (Things I Wish I Knew),https://www.youtube.com/watch?v=4DuUUZ7cOsw,2021-04-01,12:34,16123,968,31,myadvicefornewprogrammers2021thingsiwishiknew.txt
Clever Programmer,Learn JavaScript in just 10 Minutes (2021),https://www.youtube.com/watch?v=39GRFGm2JRY,2021-04-01,17:11,39284,2242,101,learnjavascriptinjust10minutes2021.txt
Clever Programmer,🔴 Build Amazon Clone from Scratch with React JS & Styled Components (Day 4 of React JS Challenge),https://www.youtube.com/watch?v=m0_13iV3F2o,2021-03-27,2:16:49,26831,822,42,buildamazonclonefromscratchwithreactjsstyledcomponentsday4ofreactjschallenge.txt
Clever Programmer,🔴 Build Amazon Clone from Scratch with React JS & Styled Components (Day 3 of React JS Challenge),https://www.youtube.com/watch?v=W5j0dpHxCj4,2021-03-26,2:31:19,25593,921,41,buildamazonclonefromscratchwithreactjsstyledcomponentsday3ofreactjschallenge.txt
Clever Programmer,🔴 Build Amazon Clone from Scratch with React JS & Styled Components (Day 2 of React JS Challenge),https://www.youtube.com/watch?v=-j9B5whi7Lw,2021-03-25,2:37:25,54502,1862,70,buildamazonclonefromscratchwithreactjsstyledcomponentsday2ofreactjschallenge.txt
Clever Programmer,🔴 DAY 1: Your Opportunity to Become a Fullstack Developer in 2021 (Day 1 of React JS Challenge),https://www.youtube.com/watch?v=n-Mn7IOAgIk,2021-03-24,1:16:46,51414,2051,82,day1youropportunitytobecomeafullstackdeveloperin2021day1ofreactjschallenge.txt
Clever Programmer,How I spot garbage developers from a mile away,https://www.youtube.com/watch?v=NuFmh3jnLyc,2021-03-19,11:55,40081,3335,403,howispotgarbagedevelopersfromamileaway.txt
Clever Programmer,channel update,https://www.youtube.com/watch?v=lzIh8wGpe6s,2021-03-07,7:37,32867,1907,240,channelupdate.txt
Clever Programmer,🔴 Building the ULTIMATE Gmail Clone with ReactJS Styled Components Part 2 of 3 | For Beginners,https://www.youtube.com/watch?v=nHYbrCiN_ec,2021-03-05,1:43:07,20858,626,32,buildingtheultimategmailclonewithreactjsstyledcomponentspart2of3forbeginners.txt
Clever Programmer,How to Become a Full Stack Developer in 2021 - Complete Roadmap For Beginners,https://www.youtube.com/watch?v=4A0N3y96UrM,2021-03-04,17:03,21805,1081,58,howtobecomeafullstackdeveloperin2021completeroadmapforbeginners.txt
Clever Programmer,Learn REACT JS in just 30 MINUTES (2021),https://www.youtube.com/watch?v=vIRBSI-elUM,2021-03-02,28:28,81004,4600,119,learnreactjsinjust30minutes2021.txt
Clever Programmer,🔴 DAY 5: The 5 Day ReactJS Challenge | How to make $100k+ as a React JS Developer 🚀,https://www.youtube.com/watch?v=eGSmujxNFMA,2021-02-26,1:40:03,11704,442,16,day5the5dayreactjschallengehowtomake100kasareactjsdeveloper.txt
Clever Programmer,🔴 DAY 4: The 5 Day ReactJS Challenge | Let's Build a Slack Clone with REACT JS Part 3,https://www.youtube.com/watch?v=imdI8XgO-sE,2021-02-25,2:29:49,15126,677,19,day4the5dayreactjschallengeletsbuildaslackclonewithreactjspart3.txt
Clever Programmer,🔴 DAY 3: The 5 Day ReactJS Challenge | Let's Build a Slack Clone with REACT JS Part 2,https://www.youtube.com/watch?v=0RZDbsXLcRg,2021-02-24,2:20:57,13840,708,27,day3the5dayreactjschallengeletsbuildaslackclonewithreactjspart2.txt
