channel_name,video_title,video_url,publish_date,video_length,views,likes,comments,transcript_filename
Clever Programmer,Insecurity is stopping you from becoming a better developer,https://www.youtube.com/watch?v=pq41n2LYIp8,2024-08-10,13:54,1428,90,26,insecurityisstoppingyoufrombecomingabetterdeveloper.txt
Clever Programmer,Is Freecodecamp Worth It? My Honest Reaction,https://www.youtube.com/watch?v=IJwLKLIR94Y,2024-07-28,18:15,4186,124,30,isfreecodecampworthitmyhonestreaction.txt
Clever Programmer,How AI ACTUALLY works... Neural Networks Deep Dive,https://www.youtube.com/watch?v=8nwLA81uJGA,2024-07-21,1:19:27,4455,125,16,howaiactuallyworksneuralnetworksdeepdive.txt
Clever Programmer,bad code cost Microsoft billions of dollars,https://www.youtube.com/watch?v=kn1U-HCxF3Y,2024-07-20,14:28,3414,113,37,badcodecostmicrosoftbillionsofdollars.txt
Clever Programmer,is this Voice AI better than GPT 4o?,https://www.youtube.com/watch?v=Hg2v86gVqd8,2024-07-14,8:57,3168,128,9,isthisvoiceaibetterthangpt4o.txt
Clever Programmer,NEW Claude AI model will *SHOCK* you. It outperforms GPT4o,https://www.youtube.com/watch?v=sK6L9SaY3eo,2024-07-06,51:14,5107,139,24,newclaudeaimodelwillshockyouitoutperformsgpt4o.txt
Clever Programmer,Why we stopped using ENV files and replaced it with this tool instead...,https://www.youtube.com/watch?v=K7E-rX6hNTY,2024-07-04,13:50,7650,219,40,whywestoppedusingenvfilesandreplaceditwiththistoolinstead.txt
Clever Programmer,F*ck Chatgpt. Learn THIS Instead,https://www.youtube.com/watch?v=uu_r26Wwa-E,2024-07-01,7:37,6930,234,70,fckchatgptlearnthisinstead.txt
Clever Programmer,STOP watching coding tutorials ❌  Do this instead.,https://www.youtube.com/watch?v=myMpO9czyfU,2024-06-29,0:40,7441,766,0,stopwatchingcodingtutorialsdothisinstead.txt
Clever Programmer,Why we stopped using VSCODE and replaced it with this AI tool instead...,https://www.youtube.com/watch?v=NTD4sBOVHlI,2024-06-18,35:20,11390,302,65,whywestoppedusingvscodeandreplaceditwiththisaitoolinstead.txt
Clever Programmer,Late Night Coding Hackathon,https://www.youtube.com/watch?v=uDwIdWe01yI,2024-05-16,1:02:13,4947,122,19,latenightcodinghackathon.txt
Clever Programmer,Full Stack Developer Guide 2024,https://www.youtube.com/watch?v=eszgZ79GjRY,2024-05-04,0:38,35602,1408,44,fullstackdeveloperguide2024.txt
Clever Programmer,Day in the Life of a Software Developer (Building a Startup),https://www.youtube.com/watch?v=aajcdM6jF5o,2024-04-16,23:15,8084,231,42,dayinthelifeofasoftwaredeveloperbuildingastartup.txt
Clever Programmer,Day 9 of building an AI SaaS to $10k/mo,https://www.youtube.com/watch?v=GyoMf8EJY7U,2024-04-14,0:54,10580,283,8,day9ofbuildinganaisaasto10kmo.txt
Clever Programmer,Day 8 of building an AI SaaS to $10k/mo,https://www.youtube.com/watch?v=AjujtKYzu_4,2024-04-13,1:00,9075,260,4,day8ofbuildinganaisaasto10kmo.txt
Clever Programmer,Day 7 of building an AI SaaS to $10k/mo,https://www.youtube.com/watch?v=fj_8mxerzz4,2024-04-11,1:00,19814,464,6,day7ofbuildinganaisaasto10kmo.txt
Clever Programmer,Day 6 of building an AI SaaS to $10k/mo,https://www.youtube.com/watch?v=l8JLM0RitqI,2024-04-09,0:57,8978,202,2,day6ofbuildinganaisaasto10kmo.txt
Clever Programmer,Quitting YouTube to Build a SaaS to $10k/mo,https://www.youtube.com/watch?v=cjJWYaFj5dk,2024-04-08,4:51,6769,280,34,quittingyoutubetobuildasaasto10kmo.txt
Clever Programmer,5 Custom GPTs That Will 10x Your Productivity as a Developer,https://www.youtube.com/watch?v=zTUN77USXAg,2024-03-28,17:18,5876,245,23,5customgptsthatwill10xyourproductivityasadeveloper.txt
Clever Programmer,Day 5 of building an AI SaaS to $10k/mo,https://www.youtube.com/watch?v=GPeYuHMYd1g,2024-03-28,1:23,2736,77,2,day5ofbuildinganaisaasto10kmo.txt
Clever Programmer,Day 4 of building an AI SaaS to $10k mo,https://www.youtube.com/watch?v=6snfLYOie_0,2024-03-26,0:55,6038,185,1,day4ofbuildinganaisaasto10kmo.txt
Clever Programmer,Day 3 of building an AI SaaS to $10k/mo,https://www.youtube.com/watch?v=DK6l9dbH_6A,2024-03-21,1:10,4108,119,6,day3ofbuildinganaisaasto10kmo.txt
Clever Programmer,Day 2 of building an AI SaaS to $10k/mo,https://www.youtube.com/watch?v=FVbbuWtvCrY,2024-03-13,1:00,6958,208,5,day2ofbuildinganaisaasto10kmo.txt
Clever Programmer,Day 1 of building an AI SaaS to $10k mo,https://www.youtube.com/watch?v=IfqT_p0p_Ho,2024-03-11,0:56,16466,837,16,day1ofbuildinganaisaasto10kmo.txt
Clever Programmer,"Build an AI SaaS in 30 Minutes (Next.js, Supabase, Stripe, LEAP AI, Vercel)",https://www.youtube.com/watch?v=aysrmDYhEqg,2024-02-15,36:13,21842,617,36,buildanaisaasin30minutesnextjssupabasestripeleapaivercel.txt
Clever Programmer,3 Skills You Need to Learn as a Developer in 2024 🔥,https://www.youtube.com/watch?v=EZlXMutb4cI,2024-02-07,0:12,7344,233,5,3skillsyouneedtolearnasadeveloperin2024.txt
Clever Programmer,POV: I want to become a software developer in 2024,https://www.youtube.com/watch?v=Mcf4zwNJyhA,2024-02-04,0:09,6527,252,1,poviwanttobecomeasoftwaredeveloperin2024.txt
Clever Programmer,😱 Computer Science is DOOMED? 😱,https://www.youtube.com/watch?v=k2m5PFIDqns,2024-02-03,0:46,10314,270,13,computerscienceisdoomed.txt
Clever Programmer,🤯  Project Manager CRUSHED Software Developers at a Hackathon,https://www.youtube.com/watch?v=dx4P93ECs1w,2024-01-31,1:00,8850,320,15,projectmanagercrushedsoftwaredevelopersatahackathon.txt
Clever Programmer,🧵 5 GPTs that will 10x Your Productivity as a Developer,https://www.youtube.com/watch?v=tcFsruRP30s,2024-01-28,0:16,9009,776,4,5gptsthatwill10xyourproductivityasadeveloper.txt
Clever Programmer,🤖 What does programming look like in the future?,https://www.youtube.com/watch?v=cDUdW1NPLCE,2024-01-27,1:01,4708,152,12,whatdoesprogramminglooklikeinthefuture.txt
Clever Programmer,🧵 How I Write Code with AI,https://www.youtube.com/watch?v=ypKLiL8KFbw,2024-01-25,0:33,5838,177,87,howiwritecodewithai.txt
Clever Programmer,"""ChatGPT is the STUPIDEST it will ever be"" 🤯 - Bill Gates & Sam Altman Podcast",https://www.youtube.com/watch?v=3_gZzK15Cmg,2024-01-24,16:13,4914,149,24,chatgptisthestupidestitwilleverbebillgatessamaltmanpodcast.txt
Clever Programmer,Top 5 Highest Paying Programming Jobs in 2024,https://www.youtube.com/watch?v=6cOk0s1m7Wg,2024-01-16,14:10,11357,368,33,top5highestpayingprogrammingjobsin2024.txt
Clever Programmer,Programming will be NO CODE in few years,https://www.youtube.com/watch?v=muQCZoZ-ZaM,2024-01-15,8:21,10602,327,49,programmingwillbenocodeinfewyears.txt
Clever Programmer,ChatGPT Store Will Make You RICH,https://www.youtube.com/watch?v=rng8oDz2Edw,2024-01-10,12:00,7736,282,23,chatgptstorewillmakeyourich.txt
Clever Programmer,Top 5 Programming Languages To Learn in 2024 to Land a Job without a College Degree,https://www.youtube.com/watch?v=R-MXLiuDJ7Y,2024-01-07,13:37,58709,760,95,top5programminglanguagestolearnin2024tolandajobwithoutacollegedegree.txt
Clever Programmer,Reacting to END of Programming Talk by Dr. Matt Welsh,https://www.youtube.com/watch?v=eJwYRANi4L0,2024-01-06,1:08:10,11060,327,82,reactingtoendofprogrammingtalkbydrmattwelsh.txt
Clever Programmer,Front-End Devs Are Done! Vercel Just Launched New AI,https://www.youtube.com/watch?v=xfJPd-kIJag,2023-12-17,20:02,20690,690,116,frontenddevsaredoneverceljustlaunchednewai.txt
Clever Programmer,ChatGPT is BANNED at Reddit ❌,https://www.youtube.com/watch?v=5u4-nLV-DY8,2023-12-10,11:27,3289,142,19,chatgptisbannedatreddit.txt
Clever Programmer,ChatGPT killer... Google's GEMINI is here 💀,https://www.youtube.com/watch?v=k7USSwXDvTs,2023-12-08,15:40,6383,258,33,chatgptkillergooglesgeminiishere.txt
Clever Programmer,Why do devs hate no-code?,https://www.youtube.com/watch?v=_X9GbcXQ9bY,2023-10-15,11:38,8614,367,71,whydodevshatenocode.txt
Clever Programmer,The EASIEST Way to Build a ChatGPT Clone,https://www.youtube.com/watch?v=haGe_t4Ax9I,2023-10-14,49:38,19844,446,47,theeasiestwaytobuildachatgptclone.txt
Clever Programmer,ChatGPT-4: HUGE Announcement for Al Developers,https://www.youtube.com/watch?v=GCIVOMB4fS0,2023-07-13,2:30,13624,430,48,chatgpt4hugeannouncementforaldevelopers.txt
Clever Programmer,Solidity Tutorial for Beginners - Full Course in 16 Hours (2023),https://www.youtube.com/watch?v=aGonv5DP910,2023-04-28,15:55:08,43723,1355,85,soliditytutorialforbeginnersfullcoursein16hours2023.txt
Clever Programmer,ChatGPT Built this App for Me!,https://www.youtube.com/watch?v=9OgVa3fpTHM,2023-04-24,18:31,15209,255,20,chatgptbuiltthisappforme.txt
Clever Programmer,Build Sushiswap Web3 Clone with Next.js & Solidity,https://www.youtube.com/watch?v=sPK4gvAGKe8,2023-04-17,36:21,7479,167,20,buildsushiswapweb3clonewithnextjssolidity.txt
Clever Programmer,Build Uber Eats Web3 Clone with Next.js & Solidity,https://www.youtube.com/watch?v=Ye-9BqD2U5c,2023-04-10,21:12,10114,209,8,buildubereatsweb3clonewithnextjssolidity.txt
Clever Programmer,Build a Stock Betting Dapp Web3 Clone with Next.js & Solidity,https://www.youtube.com/watch?v=2nivhU93_PM,2023-04-03,22:26,8360,213,9,buildastockbettingdappweb3clonewithnextjssolidity.txt
Clever Programmer,Build Airbnb Web3 Clone with Next.js & Solidity,https://www.youtube.com/watch?v=QP-QWI4NZt0,2023-03-27,30:26,11669,262,26,buildairbnbweb3clonewithnextjssolidity.txt
Clever Programmer,Build Twitter Web3 Clone with React Native!,https://www.youtube.com/watch?v=h1TKgCnWeT0,2023-03-21,32:23,12372,254,36,buildtwitterweb3clonewithreactnative.txt
Clever Programmer,Build Moonbirds Web3 Clone with Next.js & Solidity,https://www.youtube.com/watch?v=_W3BHUXar5Q,2023-03-16,29:59,4819,120,15,buildmoonbirdsweb3clonewithnextjssolidity.txt
Clever Programmer,Quitting the YouTube content treadmill.,https://www.youtube.com/watch?v=qBVOjL7wMBw,2023-03-14,27:50,10614,398,75,quittingtheyoutubecontenttreadmill.txt
Clever Programmer,Top 5 Highest Paying Programming Jobs In 2023,https://www.youtube.com/watch?v=4MTvflwVxXI,2023-02-26,9:32,57864,2210,143,top5highestpayingprogrammingjobsin2023.txt
Clever Programmer,I Built a Discord Bot with ChatGPT,https://www.youtube.com/watch?v=95_e2YoZ5SA,2023-02-25,8:35,26568,514,33,ibuiltadiscordbotwithchatgpt.txt
Clever Programmer,I Built Amazon using ChatGPT,https://www.youtube.com/watch?v=W8B7YRPbqfQ,2023-02-24,54:13,21085,667,38,ibuiltamazonusingchatgpt.txt
Clever Programmer,Will ChatGPT Replace Programmers?,https://www.youtube.com/watch?v=dkzsTOzPSVI,2023-02-10,6:47,44625,1465,165,willchatgptreplaceprogrammers.txt
Clever Programmer,Top 5 Programming Languages to Learn in 2023 to Get a Job Without a College Degree,https://www.youtube.com/watch?v=_6Zhfts2iao,2023-02-03,8:58,135644,4669,193,top5programminglanguagestolearnin2023togetajobwithoutacollegedegree.txt
Clever Programmer,Build Turo Web3 App with NextJS,https://www.youtube.com/watch?v=QObVQSmlG_c,2023-02-02,47:43,5510,125,16,buildturoweb3appwithnextjs.txt
Clever Programmer,Build Netflix with NextJS,https://www.youtube.com/watch?v=ouRC7cm05Ko,2023-01-29,34:32,18225,395,31,buildnetflixwithnextjs.txt
Clever Programmer,Will Ai replace Programmers? Here is my take.,https://www.youtube.com/watch?v=CKy6CTEiY_U,2023-01-25,0:50,425810,17888,796,willaireplaceprogrammershereismytake.txt
Clever Programmer,Build a Stock Prediction App with NextJS & Solana!,https://www.youtube.com/watch?v=0KlXTd-1I-4,2023-01-22,3:30:52,23796,516,34,buildastockpredictionappwithnextjssolana.txt
Clever Programmer,Build CashApp with SolanaPay & NextJS,https://www.youtube.com/watch?v=sZrDqLiD8ys,2023-01-21,1:45:58,17180,419,35,buildcashappwithsolanapaynextjs.txt
Clever Programmer,NFT Drop Tutorial on the Solana Blockchain,https://www.youtube.com/watch?v=wtjHSOhi4LA,2023-01-20,1:25:48,7122,201,31,nftdroptutorialonthesolanablockchain.txt
Clever Programmer,Build Instagram Clone on Solana,https://www.youtube.com/watch?v=XQCmAzVINRA,2023-01-19,3:10:25,11849,315,24,buildinstagramcloneonsolana.txt
Clever Programmer,I just asked how much developers make! 💸💸💸,https://www.youtube.com/watch?v=0Zdu5GcIQ-8,2023-01-16,0:58,882027,39162,498,ijustaskedhowmuchdevelopersmake.txt
Clever Programmer,Build a Solana Lottery Dapp,https://www.youtube.com/watch?v=uIQDNVbaQn8,2023-01-15,4:35:54,25807,739,70,buildasolanalotterydapp.txt
Clever Programmer,Chat GPT Built My App in Minutes…,https://www.youtube.com/watch?v=UfxLKdNTXW8,2023-01-12,3:50,909000,12194,504,chatgptbuiltmyappinminutes.txt
Clever Programmer,I asked developers how much MONEY they make,https://www.youtube.com/watch?v=8jRB-2AQ-mI,2023-01-07,8:01,1345139,22965,1264,iaskeddevelopershowmuchmoneytheymake.txt
Clever Programmer,Build WhatsApp Blog Web3 App with NextJS,https://www.youtube.com/watch?v=47JfV25M9UY,2023-01-05,31:51,9402,226,17,buildwhatsappblogweb3appwithnextjs.txt
Clever Programmer,Build Instagram Web3 App with Infura & NextJS,https://www.youtube.com/watch?v=cZUgS19WM1g,2022-12-29,1:18:16,10871,294,23,buildinstagramweb3appwithinfuranextjs.txt
Clever Programmer,Should YOU Learn React Native? 👨‍💻,https://www.youtube.com/watch?v=D2RK-o7dPL8,2022-12-21,1:00,109144,5520,90,shouldyoulearnreactnative.txt
Clever Programmer,Build Dev.to Blog Web3 App with Infura & NextJS,https://www.youtube.com/watch?v=jffY5B163RI,2022-12-16,1:24:55,8270,226,19,builddevtoblogweb3appwithinfuranextjs.txt
Clever Programmer,F*ck becoming a JavaScript developer.,https://www.youtube.com/watch?v=_VmhjM-hWKY,2022-12-09,20:40,21444,775,153,fckbecomingajavascriptdeveloper.txt
Clever Programmer,F*ck JavaScript. Master THIS Instead.,https://www.youtube.com/watch?v=Jcoh2vsSLbM,2022-12-08,14:46,58137,2802,245,fckjavascriptmasterthisinstead.txt
Clever Programmer,Build tiny coding habits daily.,https://www.youtube.com/watch?v=-oVT93542nM,2022-12-07,7:16,31708,1724,89,buildtinycodinghabitsdaily.txt
Clever Programmer,f*ck the algorithm. This video is for you.,https://www.youtube.com/watch?v=D4m9nmOrpQE,2022-12-05,5:08,26769,1602,225,fckthealgorithmthisvideoisforyou.txt
Clever Programmer,BIG React JS UPDATE!!!,https://www.youtube.com/watch?v=Q4GGfY5qDaU,2022-12-03,0:49,217078,10521,115,bigreactjsupdate.txt
Clever Programmer,Highest Paying Programming Jobs 👨🏻‍💻💸,https://www.youtube.com/watch?v=phQfoyC3dQA,2022-11-30,1:00,1677371,72791,811,highestpayingprogrammingjobs.txt
Clever Programmer,Build TikTok Web3 App with Infura & NextJS,https://www.youtube.com/watch?v=ePMMLFrehdo,2022-11-30,1:32:27,8806,261,25,buildtiktokweb3appwithinfuranextjs.txt
Clever Programmer,Devs are losing jobs. DO THIS NOW.,https://www.youtube.com/watch?v=tr_vYIIdtPs,2022-11-29,12:23,14650,967,142,devsarelosingjobsdothisnow.txt
Clever Programmer,Reading code be like 👨‍💻,https://www.youtube.com/watch?v=EY2V74AEVek,2022-11-29,0:08,37392,1116,19,readingcodebelike.txt
Clever Programmer,I don't know. Leave me alone.,https://www.youtube.com/watch?v=b6VgFW3vg84,2022-11-29,0:10,45423,1136,26,idontknowleavemealone.txt
Clever Programmer,Nobody Will Tell You THIS About Coding.,https://www.youtube.com/watch?v=oVq46-WYRKA,2022-11-28,0:54,111411,5937,171,nobodywilltellyouthisaboutcoding.txt
Clever Programmer,Junior Dev Casually Force Pushing to GIT.,https://www.youtube.com/watch?v=XNiYH_U7KZE,2022-11-23,0:09,17373,433,8,juniordevcasuallyforcepushingtogit.txt
Clever Programmer,React Interview Questions Part 1,https://www.youtube.com/watch?v=g1nazjHUoIM,2022-11-22,0:33,12419,569,0,reactinterviewquestionspart1.txt
Clever Programmer,YOU are the Reason Why You DON'T Have a Job As a Software Developer 👨🏻‍💻,https://www.youtube.com/watch?v=N2ybWFEsZiI,2022-11-15,0:54,14498,962,15,youarethereasonwhyyoudonthaveajobasasoftwaredeveloper.txt
Clever Programmer,Build Ebay Web3 App with Infura & NextJS,https://www.youtube.com/watch?v=BhxaB7QRdnk,2022-11-15,1:25:04,8621,208,24,buildebayweb3appwithinfuranextjs.txt
Clever Programmer,Obsession Is More Important Than Consistency 💯👨🏻‍💻,https://www.youtube.com/watch?v=D1mjbvH7BBg,2022-11-13,0:38,20539,1275,24,obsessionismoreimportantthanconsistency.txt
Clever Programmer,Code Every SINGLE Day 👨🏻‍💻💯,https://www.youtube.com/watch?v=Kf9vlxCrbv8,2022-11-12,0:46,15147,1110,10,codeeverysingleday.txt
Clever Programmer,Coding is Not Hard YOU are Just Weak 💯.,https://www.youtube.com/watch?v=r8TVJNQsT6Q,2022-11-11,0:39,16598,872,17,codingisnothardyouarejustweak.txt
Clever Programmer,How to Become A Self-Taught Developer? 👩‍💻,https://www.youtube.com/watch?v=F8-iReLrezc,2022-11-10,0:38,27954,1877,21,howtobecomeaselftaughtdeveloper.txt
Clever Programmer,Do I Need to Know Math to Become a Programmer? 👨‍💻,https://www.youtube.com/watch?v=3nJeaEWiWos,2022-11-05,0:24,20223,855,9,doineedtoknowmathtobecomeaprogrammer.txt
Clever Programmer,Are YOU Too Old to Start Coding 👴?,https://www.youtube.com/watch?v=v2INV3qsA4c,2022-11-05,0:27,9286,449,7,areyoutoooldtostartcoding.txt
Clever Programmer,The BIGGEST Secret to Improve Your Coding Skills 👨‍💻,https://www.youtube.com/watch?v=yFWflcSUd_Y,2022-11-03,0:44,32479,2417,31,thebiggestsecrettoimproveyourcodingskills.txt
Clever Programmer,How to ACTUALLY Get Good at Coding Fast 👨‍💻,https://www.youtube.com/watch?v=HFz8yj5B5_c,2022-11-01,0:57,17163,1261,45,howtoactuallygetgoodatcodingfast.txt
Clever Programmer,Build Uniswap 3.0 App with Infura & NextJS (Full Swap Functionality),https://www.youtube.com/watch?v=xR29afPvdxQ,2022-10-31,1:08:05,18113,368,42,builduniswap30appwithinfuranextjsfullswapfunctionality.txt
Clever Programmer,Do You Need a College Degree As A Software Developer? 👨‍💻,https://www.youtube.com/watch?v=188koHWiC4o,2022-10-30,0:56,74473,4234,46,doyouneedacollegedegreeasasoftwaredeveloper.txt
Clever Programmer,The Power of Programming ✨👨‍💻,https://www.youtube.com/watch?v=OMqh1XSM-m0,2022-10-29,0:28,13346,703,10,thepowerofprogramming.txt
Clever Programmer,Are YOU Too Old To Start Programming? 👨🏻‍💻,https://www.youtube.com/watch?v=6Gtmxuc5Wy4,2022-10-28,0:38,11005,576,10,areyoutoooldtostartprogramming.txt
Clever Programmer,How To Become a 6 Figure Freelance Developer 👨‍💻💰,https://www.youtube.com/watch?v=Uq7BubmzSX4,2022-10-27,0:56,23068,1275,17,howtobecomea6figurefreelancedeveloper.txt
Clever Programmer,What Programming Languages To Avoid ❌,https://www.youtube.com/watch?v=-2x21965rzU,2022-10-26,0:44,82385,3292,181,whatprogramminglanguagestoavoid.txt
Clever Programmer,Should You Code Everyday? 👩‍💻,https://www.youtube.com/watch?v=y5BnYfybdog,2022-10-25,0:27,11592,693,5,shouldyoucodeeveryday.txt
Clever Programmer,Is it Too Early to Get Into Web 3.0? 👨‍💻,https://www.youtube.com/watch?v=a3zaCGxjCPA,2022-10-24,0:33,9012,453,9,isittooearlytogetintoweb30.txt
Clever Programmer,Squid Game Challenge for Developers,https://www.youtube.com/watch?v=z9usw7wp_z0,2022-10-23,3:27,8343,313,39,squidgamechallengefordevelopers.txt
Clever Programmer,"How to Make $100,000 a Year As a Blockchain Developer 👨🏻‍💻",https://www.youtube.com/watch?v=gVDahHMqSnE,2022-10-22,0:29,14523,551,21,howtomake100000ayearasablockchaindeveloper.txt
Clever Programmer,Do You NEED a College Degree as a Software Developer? 👨‍💻,https://www.youtube.com/watch?v=a0UPp9diNcU,2022-10-22,0:59,32784,1737,34,doyouneedacollegedegreeasasoftwaredeveloper_2.txt
Clever Programmer,How an Alter Ego Can Make You A Better Developer 👨‍💻,https://www.youtube.com/watch?v=5fTIGkHp5vQ,2022-10-21,0:38,18377,788,5,howanalteregocanmakeyouabetterdeveloper.txt
Clever Programmer,Build a Lottery with Solidity (Infura) & Next.js,https://www.youtube.com/watch?v=2gY2frjARBA,2022-10-20,1:35:22,13435,445,49,buildalotterywithsolidityinfuranextjs.txt
Clever Programmer,How to Get Confidence In Coding 👨‍💻,https://www.youtube.com/watch?v=Qfgaq_50DtY,2022-10-20,0:28,11001,696,9,howtogetconfidenceincoding.txt
Clever Programmer,The Reason Why YOU Can't Code 👨🏻‍💻,https://www.youtube.com/watch?v=hwFJZIp8n_U,2022-10-19,0:36,15309,693,13,thereasonwhyyoucantcode.txt
Clever Programmer,Your Coding Skills S*ck 👨‍💻,https://www.youtube.com/watch?v=UCJC8q8VWdU,2022-10-18,0:42,11261,872,19,yourcodingskillssck.txt
Clever Programmer,How Important are social skills for developers? 👨‍💻,https://www.youtube.com/watch?v=y5f_WV8EqwY,2022-10-17,0:25,7527,460,10,howimportantaresocialskillsfordevelopers.txt
Clever Programmer,4 Tips for Beginner Developers 🧑‍💻,https://www.youtube.com/watch?v=F4fqVKzSVGo,2022-10-17,0:57,7105,414,9,4tipsforbeginnerdevelopers.txt
Clever Programmer,Self Imposed Limitations as a Developer 👨‍💻,https://www.youtube.com/watch?v=if43-ApoLa0,2022-10-16,0:28,5616,241,5,selfimposedlimitationsasadeveloper.txt
Clever Programmer,The Reason You Are Stuck In Your Coding Journey 👨‍💻,https://www.youtube.com/watch?v=A74x23tx6sM,2022-10-15,0:33,10058,604,12,thereasonyouarestuckinyourcodingjourney.txt
Clever Programmer,Nobody Cares About Your Ideas 💡,https://www.youtube.com/watch?v=HQ9I5DY6SNs,2022-10-14,0:40,211102,7955,59,nobodycaresaboutyourideas.txt
Clever Programmer,The Best Way to Lead Others Long Term 🚀,https://www.youtube.com/watch?v=JmgOeLekGvg,2022-10-14,0:28,6914,314,4,thebestwaytoleadotherslongterm.txt
Clever Programmer,How to Overcome Imposter Syndrome,https://www.youtube.com/watch?v=tJdJnNg1Www,2022-10-14,0:25,6924,407,7,howtoovercomeimpostersyndrome.txt
Clever Programmer,The Brutal Truth About Being a 6-Figure Developer 💯,https://www.youtube.com/watch?v=aQF22i5XiV4,2022-10-13,0:51,7455,544,20,thebrutaltruthaboutbeinga6figuredeveloper.txt
Clever Programmer,How to Know If an Idea Is Worth Executing 💯,https://www.youtube.com/watch?v=E4qEtCm2Q54,2022-10-13,0:47,6015,319,4,howtoknowifanideaisworthexecuting.txt
Clever Programmer,Why You DON'T Succeed as a Self-Taught Developer ❌👨‍💻,https://www.youtube.com/watch?v=DO1Hj7QybZc,2022-10-13,0:32,22757,1444,10,whyyoudontsucceedasaselftaughtdeveloper.txt
Clever Programmer,Advice for a 20 year old Programmer 👩‍💻,https://www.youtube.com/watch?v=fveU9AWeI2c,2022-10-12,0:31,10852,660,18,advicefora20yearoldprogrammer.txt
Clever Programmer,Why coding is the most powerful force in the world 🌎,https://www.youtube.com/watch?v=MBUkDwUjbF4,2022-10-12,0:36,29250,1118,16,whycodingisthemostpowerfulforceintheworld.txt
Clever Programmer,Build a Blog App with Solana & React (Solana CRUD 101),https://www.youtube.com/watch?v=PWvbMWyuYNQ,2022-09-26,2:26:26,23965,580,34,buildablogappwithsolanareactsolanacrud101.txt
Clever Programmer,Build Venmo Web3 Clone with Next.js & Solidity,https://www.youtube.com/watch?v=rQadaQXSO08,2022-09-21,1:39:20,13042,419,41,buildvenmoweb3clonewithnextjssolidity.txt
Clever Programmer,Build Airbnb with Solana & Next.js,https://www.youtube.com/watch?v=HIWuUdo9utw,2022-09-19,2:55:05,17566,416,22,buildairbnbwithsolananextjs.txt
Clever Programmer,Build APE Coin DAO with Next.js & thirdweb,https://www.youtube.com/watch?v=mzpFbKnrOrc,2022-09-08,1:07:08,14149,309,54,buildapecoindaowithnextjsthirdweb.txt
Clever Programmer,Build Solana Todo App with Next.js & Rust (Anchor),https://www.youtube.com/watch?v=3_zoGgffxac,2022-09-06,2:57:38,25603,719,47,buildsolanatodoappwithnextjsrustanchor.txt
Clever Programmer,Python Tutorial for Beginners - Full Course in 12 Hours (2022),https://www.youtube.com/watch?v=B9nFMZIYQl0,2022-09-02,11:34:49,449204,15694,457,pythontutorialforbeginnersfullcoursein12hours2022.txt
Clever Programmer,"Explain this coding meme, win $100",https://www.youtube.com/watch?v=DCdfkRi8Xpo,2022-08-19,7:55,18488,557,48,explainthiscodingmemewin100.txt
Clever Programmer,Learn Arrays & Objects in Vanilla JavaScript for Beginners (Data Structures),https://www.youtube.com/watch?v=gnbzqtd2zgM,2022-08-17,1:32:58,28569,1264,62,learnarraysobjectsinvanillajavascriptforbeginnersdatastructures.txt
Clever Programmer,"Build Rock Paper Scissors Game with Vanilla JavaScript for Beginners (HTML, CSS, JS)",https://www.youtube.com/watch?v=tzjF8LkfWfc,2022-08-13,45:32,15077,525,23,buildrockpaperscissorsgamewithvanillajavascriptforbeginnershtmlcssjs.txt
Clever Programmer,Build Reddit App with NextJS,https://www.youtube.com/watch?v=W8IK3MeJ5H0,2022-08-09,3:30:46,23309,811,59,buildredditappwithnextjs.txt
Clever Programmer,Save Money With This Hosting Platform 👨‍💻,https://www.youtube.com/watch?v=yaVmaAeZjHY,2022-08-07,0:29,13616,548,11,savemoneywiththishostingplatform.txt
Clever Programmer,"Build Tip Calculator with Vanilla JavaScript for Beginners (HTML, CSS, JS)",https://www.youtube.com/watch?v=Q3PjnZxW6i0,2022-08-04,45:42,19875,800,47,buildtipcalculatorwithvanillajavascriptforbeginnershtmlcssjs.txt
Clever Programmer,"🔴 Build a Todo App with Solidity, Next.js & Truffle",https://www.youtube.com/watch?v=awQTDVvYyjI,2022-07-26,1:25:19,29528,1083,84,buildatodoappwithsoliditynextjstruffle.txt
Clever Programmer,Should I Start a Hindi Coding Channel?,https://www.youtube.com/watch?v=4TyHF5WV6eM,2022-07-20,10:12,65272,5539,2577,shouldistartahindicodingchannel.txt
Clever Programmer,Which one should you choose? AWS or Firebase or Digital Ocean 🔥🤯👨‍💻,https://www.youtube.com/watch?v=U4xnsRk4DMc,2022-07-15,1:00,135102,6253,93,whichoneshouldyouchooseawsorfirebaseordigitalocean.txt
Clever Programmer,"🔴 Build Modern Portfolio with NextJS, TypeScript, SSR, and React Bricks CMS",https://www.youtube.com/watch?v=Ym6RYyRBPaA,2022-07-14,1:06:45,168270,6252,147,buildmodernportfoliowithnextjstypescriptssrandreactbrickscms.txt
Clever Programmer,🔴  Build Medium App with Next.js and Firebase,https://www.youtube.com/watch?v=xnshvkVrsw8,2022-07-08,4:14:20,46102,1255,84,buildmediumappwithnextjsandfirebase.txt
Clever Programmer,"🔴  Build Bored Ape Yacht Club with Next.js, Tailwind & Thirdweb (NFT Drop Tutorial)",https://www.youtube.com/watch?v=P5jetKCsupo,2022-07-04,47:24,18929,549,39,buildboredapeyachtclubwithnextjstailwindthirdwebnftdroptutorial.txt
